Sheet: 20
A1: 119 | B1: 0 | C1: 0 | D1: -2 | E1: of:=ABS([.B1])+ABS([.C1])+ABS([.D1]) -> 2 | F1: v=<98,-17,-8> | G1: of:=MIN([.E$1:.E$1048576]) -> 2
A2: 170 | B2: -1 | C2: -1 | D2: 0 | E2: of:=ABS([.B2])+ABS([.C2])+ABS([.D2]) -> 2 | F2: v=<3,-10,-8>
A3: 5 | B3: 3 | C3: 0 | D3: 0 | E3: of:=ABS([.B3])+ABS([.C3])+ABS([.D3]) -> 3
A4: 91 | B4: -1 | C4: 1 | D4: 1 | E4: of:=ABS([.B4])+ABS([.C4])+ABS([.D4]) -> 3
A5: 101 | B5: 0 | C5: -1 | D5: -2 | E5: of:=ABS([.B5])+ABS([.C5])+ABS([.D5]) -> 3
A6: 155 | B6: 0 | C6: -3 | D6: 0 | E6: of:=ABS([.B6])+ABS([.C6])+ABS([.D6]) -> 3
A7: 158 | B7: -2 | C7: 0 | D7: 1 | E7: of:=ABS([.B7])+ABS([.C7])+ABS([.D7]) -> 3
A8: 8 | B8: -2 | C8: 0 | D8: 2 | E8: of:=ABS([.B8])+ABS([.C8])+ABS([.D8]) -> 4
A9: 89 | B9: 0 | C9: 2 | D9: 2 | E9: of:=ABS([.B9])+ABS([.C9])+ABS([.D9]) -> 4
A10: 120 | B10: 2 | C10: 1 | D10: 1 | E10: of:=ABS([.B10])+ABS([.C10])+ABS([.D10]) -> 4
A11: 237 | B11: 1 | C11: 0 | D11: -3 | E11: of:=ABS([.B11])+ABS([.C11])+ABS([.D11]) -> 4
A12: 265 | B12: -1 | C12: 2 | D12: -1 | E12: of:=ABS([.B12])+ABS([.C12])+ABS([.D12]) -> 4
A13: 297 | B13: 1 | C13: 0 | D13: 3 | E13: of:=ABS([.B13])+ABS([.C13])+ABS([.D13]) -> 4
A14: 319 | B14: -2 | C14: -2 | D14: 0 | E14: of:=ABS([.B14])+ABS([.C14])+ABS([.D14]) -> 4
A15: 343 | B15: -4 | C15: 0 | D15: 0 | E15: of:=ABS([.B15])+ABS([.C15])+ABS([.D15]) -> 4
A16: 24 | B16: 0 | C16: 5 | D16: 0 | E16: of:=ABS([.B16])+ABS([.C16])+ABS([.D16]) -> 5
A17: 41 | B17: 2 | C17: -3 | D17: 0 | E17: of:=ABS([.B17])+ABS([.C17])+ABS([.D17]) -> 5
A18: 93 | B18: 2 | C18: 1 | D18: -2 | E18: of:=ABS([.B18])+ABS([.C18])+ABS([.D18]) -> 5
A19: 111 | B19: 0 | C19: 1 | D19: -4 | E19: of:=ABS([.B19])+ABS([.C19])+ABS([.D19]) -> 5
A20: 132 | B20: -4 | C20: 1 | D20: 0 | E20: of:=ABS([.B20])+ABS([.C20])+ABS([.D20]) -> 5
A21: 298 | B21: 2 | C21: -2 | D21: -1 | E21: of:=ABS([.B21])+ABS([.C21])+ABS([.D21]) -> 5
A22: 304 | B22: 1 | C22: 3 | D22: -1 | E22: of:=ABS([.B22])+ABS([.C22])+ABS([.D22]) -> 5
A23: 311 | B23: -1 | C23: 4 | D23: 0 | E23: of:=ABS([.B23])+ABS([.C23])+ABS([.D23]) -> 5
A24: 352 | B24: -1 | C24: -2 | D24: 2 | E24: of:=ABS([.B24])+ABS([.C24])+ABS([.D24]) -> 5
A25: 357 | B25: 1 | C25: 1 | D25: -3 | E25: of:=ABS([.B25])+ABS([.C25])+ABS([.D25]) -> 5
A26: 416 | B26: 1 | C26: -3 | D26: 1 | E26: of:=ABS([.B26])+ABS([.C26])+ABS([.D26]) -> 5
A27: 36 | B27: 2 | C27: -4 | D27: 0 | E27: of:=ABS([.B27])+ABS([.C27])+ABS([.D27]) -> 6
A28: 48 | B28: -6 | C28: 0 | D28: 0 | E28: of:=ABS([.B28])+ABS([.C28])+ABS([.D28]) -> 6
A29: 55 | B29: -1 | C29: 4 | D29: 1 | E29: of:=ABS([.B29])+ABS([.C29])+ABS([.D29]) -> 6
A30: 82 | B30: -3 | C30: 3 | D30: 0 | E30: of:=ABS([.B30])+ABS([.C30])+ABS([.D30]) -> 6
A31: 246 | B31: -1 | C31: 4 | D31: -1 | E31: of:=ABS([.B31])+ABS([.C31])+ABS([.D31]) -> 6
A32: 283 | B32: 4 | C32: 2 | D32: 0 | E32: of:=ABS([.B32])+ABS([.C32])+ABS([.D32]) -> 6
A33: 348 | B33: 0 | C33: -3 | D33: 3 | E33: of:=ABS([.B33])+ABS([.C33])+ABS([.D33]) -> 6
A34: 370 | B34: -1 | C34: 0 | D34: 5 | E34: of:=ABS([.B34])+ABS([.C34])+ABS([.D34]) -> 6
A35: 391 | B35: 5 | C35: 0 | D35: -1 | E35: of:=ABS([.B35])+ABS([.C35])+ABS([.D35]) -> 6
A36: 40 | B36: 3 | C36: -4 | D36: 0 | E36: of:=ABS([.B36])+ABS([.C36])+ABS([.D36]) -> 7
A37: 50 | B37: -3 | C37: 4 | D37: 0 | E37: of:=ABS([.B37])+ABS([.C37])+ABS([.D37]) -> 7
A38: 90 | B38: -3 | C38: -2 | D38: 2 | E38: of:=ABS([.B38])+ABS([.C38])+ABS([.D38]) -> 7
A39: 127 | B39: 0 | C39: 4 | D39: 3 | E39: of:=ABS([.B39])+ABS([.C39])+ABS([.D39]) -> 7
A40: 129 | B40: 1 | C40: -1 | D40: -5 | E40: of:=ABS([.B40])+ABS([.C40])+ABS([.D40]) -> 7
A41: 167 | B41: -4 | C41: 0 | D41: 3 | E41: of:=ABS([.B41])+ABS([.C41])+ABS([.D41]) -> 7
A42: 303 | B42: -3 | C42: -4 | D42: 0 | E42: of:=ABS([.B42])+ABS([.C42])+ABS([.D42]) -> 7
A43: 368 | B43: 0 | C43: -6 | D43: 1 | E43: of:=ABS([.B43])+ABS([.C43])+ABS([.D43]) -> 7
A44: 398 | B44: 0 | C44: 3 | D44: 4 | E44: of:=ABS([.B44])+ABS([.C44])+ABS([.D44]) -> 7
A45: 420 | B45: 4 | C45: 0 | D45: -3 | E45: of:=ABS([.B45])+ABS([.C45])+ABS([.D45]) -> 7
A46: 0 | B46: -5 | C46: 1 | D46: -2 | E46: of:=ABS([.B46])+ABS([.C46])+ABS([.D46]) -> 8
A47: 3 | B47: 1 | C47: 0 | D47: 7 | E47: of:=ABS([.B47])+ABS([.C47])+ABS([.D47]) -> 8
A48: 63 | B48: 5 | C48: 1 | D48: -2 | E48: of:=ABS([.B48])+ABS([.C48])+ABS([.D48]) -> 8
A49: 113 | B49: 0 | C49: 0 | D49: 8 | E49: of:=ABS([.B49])+ABS([.C49])+ABS([.D49]) -> 8
A50: 160 | B50: 3 | C50: 0 | D50: 5 | E50: of:=ABS([.B50])+ABS([.C50])+ABS([.D50]) -> 8
A51: 205 | B51: 4 | C51: 0 | D51: -4 | E51: of:=ABS([.B51])+ABS([.C51])+ABS([.D51]) -> 8
A52: 208 | B52: -4 | C52: -4 | D52: 0 | E52: of:=ABS([.B52])+ABS([.C52])+ABS([.D52]) -> 8
A53: 221 | B53: 5 | C53: 0 | D53: 3 | E53: of:=ABS([.B53])+ABS([.C53])+ABS([.D53]) -> 8
A54: 256 | B54: 1 | C54: 2 | D54: 5 | E54: of:=ABS([.B54])+ABS([.C54])+ABS([.D54]) -> 8
A55: 314 | B55: -3 | C55: 2 | D55: 3 | E55: of:=ABS([.B55])+ABS([.C55])+ABS([.D55]) -> 8
A56: 321 | B56: 2 | C56: 5 | D56: -1 | E56: of:=ABS([.B56])+ABS([.C56])+ABS([.D56]) -> 8
A57: 324 | B57: 0 | C57: -1 | D57: 7 | E57: of:=ABS([.B57])+ABS([.C57])+ABS([.D57]) -> 8
A58: 353 | B58: 5 | C58: -1 | D58: 2 | E58: of:=ABS([.B58])+ABS([.C58])+ABS([.D58]) -> 8
A59: 375 | B59: 3 | C59: -1 | D59: -4 | E59: of:=ABS([.B59])+ABS([.C59])+ABS([.D59]) -> 8
A60: 390 | B60: 0 | C60: -2 | D60: 6 | E60: of:=ABS([.B60])+ABS([.C60])+ABS([.D60]) -> 8
A61: 65 | B61: -3 | C61: -6 | D61: 0 | E61: of:=ABS([.B61])+ABS([.C61])+ABS([.D61]) -> 9
A62: 126 | B62: -6 | C62: 0 | D62: 3 | E62: of:=ABS([.B62])+ABS([.C62])+ABS([.D62]) -> 9
A63: 131 | B63: 4 | C63: 0 | D63: 5 | E63: of:=ABS([.B63])+ABS([.C63])+ABS([.D63]) -> 9
A64: 133 | B64: -1 | C64: 5 | D64: -3 | E64: of:=ABS([.B64])+ABS([.C64])+ABS([.D64]) -> 9
A65: 148 | B65: 4 | C65: 2 | D65: 3 | E65: of:=ABS([.B65])+ABS([.C65])+ABS([.D65]) -> 9
A66: 157 | B66: -2 | C66: 2 | D66: 5 | E66: of:=ABS([.B66])+ABS([.C66])+ABS([.D66]) -> 9
A67: 161 | B67: 0 | C67: 6 | D67: -3 | E67: of:=ABS([.B67])+ABS([.C67])+ABS([.D67]) -> 9
A68: 223 | B68: 1 | C68: -7 | D68: 1 | E68: of:=ABS([.B68])+ABS([.C68])+ABS([.D68]) -> 9
A69: 226 | B69: -2 | C69: -7 | D69: 0 | E69: of:=ABS([.B69])+ABS([.C69])+ABS([.D69]) -> 9
A70: 287 | B70: -2 | C70: -1 | D70: 6 | E70: of:=ABS([.B70])+ABS([.C70])+ABS([.D70]) -> 9
A71: 295 | B71: -1 | C71: 0 | D71: -8 | E71: of:=ABS([.B71])+ABS([.C71])+ABS([.D71]) -> 9
A72: 305 | B72: -7 | C72: 0 | D72: -2 | E72: of:=ABS([.B72])+ABS([.C72])+ABS([.D72]) -> 9
A73: 338 | B73: -6 | C73: 1 | D73: -2 | E73: of:=ABS([.B73])+ABS([.C73])+ABS([.D73]) -> 9
A74: 342 | B74: -6 | C74: 0 | D74: -3 | E74: of:=ABS([.B74])+ABS([.C74])+ABS([.D74]) -> 9
A75: 376 | B75: -1 | C75: -7 | D75: -1 | E75: of:=ABS([.B75])+ABS([.C75])+ABS([.D75]) -> 9
A76: 385 | B76: 1 | C76: 1 | D76: -7 | E76: of:=ABS([.B76])+ABS([.C76])+ABS([.D76]) -> 9
A77: 399 | B77: 7 | C77: 0 | D77: 2 | E77: of:=ABS([.B77])+ABS([.C77])+ABS([.D77]) -> 9
A78: 413 | B78: 1 | C78: -5 | D78: 3 | E78: of:=ABS([.B78])+ABS([.C78])+ABS([.D78]) -> 9
A79: 6 | B79: -1 | C79: -3 | D79: 6 | E79: of:=ABS([.B79])+ABS([.C79])+ABS([.D79]) -> 10
A80: 20 | B80: -5 | C80: -1 | D80: 4 | E80: of:=ABS([.B80])+ABS([.C80])+ABS([.D80]) -> 10
A81: 115 | B81: -2 | C81: 3 | D81: -5 | E81: of:=ABS([.B81])+ABS([.C81])+ABS([.D81]) -> 10
A82: 177 | B82: -1 | C82: -7 | D82: 2 | E82: of:=ABS([.B82])+ABS([.C82])+ABS([.D82]) -> 10
A83: 274 | B83: 0 | C83: 8 | D83: -2 | E83: of:=ABS([.B83])+ABS([.C83])+ABS([.D83]) -> 10
A84: 322 | B84: -6 | C84: -3 | D84: 1 | E84: of:=ABS([.B84])+ABS([.C84])+ABS([.D84]) -> 10
A85: 346 | B85: 0 | C85: 9 | D85: -1 | E85: of:=ABS([.B85])+ABS([.C85])+ABS([.D85]) -> 10
A86: 377 | B86: 8 | C86: 1 | D86: -1 | E86: of:=ABS([.B86])+ABS([.C86])+ABS([.D86]) -> 10
A87: 380 | B87: 5 | C87: 0 | D87: -5 | E87: of:=ABS([.B87])+ABS([.C87])+ABS([.D87]) -> 10
A88: 401 | B88: 5 | C88: 2 | D88: -3 | E88: of:=ABS([.B88])+ABS([.C88])+ABS([.D88]) -> 10
A89: 407 | B89: 3 | C89: -4 | D89: -3 | E89: of:=ABS([.B89])+ABS([.C89])+ABS([.D89]) -> 10
A90: 28 | B90: -3 | C90: 7 | D90: 1 | E90: of:=ABS([.B90])+ABS([.C90])+ABS([.D90]) -> 11
A91: 66 | B91: 1 | C91: -5 | D91: 5 | E91: of:=ABS([.B91])+ABS([.C91])+ABS([.D91]) -> 11
A92: 84 | B92: 5 | C92: -2 | D92: -4 | E92: of:=ABS([.B92])+ABS([.C92])+ABS([.D92]) -> 11
A93: 86 | B93: -5 | C93: -2 | D93: 4 | E93: of:=ABS([.B93])+ABS([.C93])+ABS([.D93]) -> 11
A94: 100 | B94: 8 | C94: -3 | D94: 0 | E94: of:=ABS([.B94])+ABS([.C94])+ABS([.D94]) -> 11
A95: 151 | B95: -2 | C95: -4 | D95: -5 | E95: of:=ABS([.B95])+ABS([.C95])+ABS([.D95]) -> 11
A96: 152 | B96: 1 | C96: 7 | D96: 3 | E96: of:=ABS([.B96])+ABS([.C96])+ABS([.D96]) -> 11
A97: 187 | B97: -8 | C97: 0 | D97: -3 | E97: of:=ABS([.B97])+ABS([.C97])+ABS([.D97]) -> 11
A98: 224 | B98: 4 | C98: -3 | D98: -4 | E98: of:=ABS([.B98])+ABS([.C98])+ABS([.D98]) -> 11
A99: 238 | B99: 3 | C99: 6 | D99: -2 | E99: of:=ABS([.B99])+ABS([.C99])+ABS([.D99]) -> 11
A100: 249 | B100: -5 | C100: 5 | D100: 1 | E100: of:=ABS([.B100])+ABS([.C100])+ABS([.D100]) -> 11
A101: 251 | B101: -3 | C101: 5 | D101: -3 | E101: of:=ABS([.B101])+ABS([.C101])+ABS([.D101]) -> 11
A102: 257 | B102: 6 | C102: 5 | D102: 0 | E102: of:=ABS([.B102])+ABS([.C102])+ABS([.D102]) -> 11
A103: 266 | B103: 4 | C103: 2 | D103: -5 | E103: of:=ABS([.B103])+ABS([.C103])+ABS([.D103]) -> 11
A104: 275 | B104: -7 | C104: -1 | D104: 3 | E104: of:=ABS([.B104])+ABS([.C104])+ABS([.D104]) -> 11
A105: 292 | B105: 3 | C105: -6 | D105: -2 | E105: of:=ABS([.B105])+ABS([.C105])+ABS([.D105]) -> 11
A106: 310 | B106: -3 | C106: -7 | D106: -1 | E106: of:=ABS([.B106])+ABS([.C106])+ABS([.D106]) -> 11
A107: 323 | B107: 3 | C107: -8 | D107: 0 | E107: of:=ABS([.B107])+ABS([.C107])+ABS([.D107]) -> 11
A108: 332 | B108: -5 | C108: -6 | D108: 0 | E108: of:=ABS([.B108])+ABS([.C108])+ABS([.D108]) -> 11
A109: 350 | B109: 0 | C109: -4 | D109: -7 | E109: of:=ABS([.B109])+ABS([.C109])+ABS([.D109]) -> 11
A110: 356 | B110: 7 | C110: 4 | D110: 0 | E110: of:=ABS([.B110])+ABS([.C110])+ABS([.D110]) -> 11
A111: 358 | B111: 0 | C111: 1 | D111: 10 | E111: of:=ABS([.B111])+ABS([.C111])+ABS([.D111]) -> 11
A112: 18 | B112: 2 | C112: 2 | D112: 8 | E112: of:=ABS([.B112])+ABS([.C112])+ABS([.D112]) -> 12
A113: 73 | B113: -5 | C113: -1 | D113: 6 | E113: of:=ABS([.B113])+ABS([.C113])+ABS([.D113]) -> 12
A114: 87 | B114: 0 | C114: 2 | D114: -10 | E114: of:=ABS([.B114])+ABS([.C114])+ABS([.D114]) -> 12
A115: 116 | B115: 9 | C115: 0 | D115: -3 | E115: of:=ABS([.B115])+ABS([.C115])+ABS([.D115]) -> 12
A116: 124 | B116: 4 | C116: -2 | D116: -6 | E116: of:=ABS([.B116])+ABS([.C116])+ABS([.D116]) -> 12
A117: 139 | B117: 0 | C117: 5 | D117: 7 | E117: of:=ABS([.B117])+ABS([.C117])+ABS([.D117]) -> 12
A118: 153 | B118: 3 | C118: 9 | D118: 0 | E118: of:=ABS([.B118])+ABS([.C118])+ABS([.D118]) -> 12
A119: 176 | B119: 0 | C119: -1 | D119: -11 | E119: of:=ABS([.B119])+ABS([.C119])+ABS([.D119]) -> 12
A120: 181 | B120: -4 | C120: -1 | D120: -7 | E120: of:=ABS([.B120])+ABS([.C120])+ABS([.D120]) -> 12
A121: 183 | B121: -8 | C121: 3 | D121: 1 | E121: of:=ABS([.B121])+ABS([.C121])+ABS([.D121]) -> 12
A122: 193 | B122: 0 | C122: 6 | D122: -6 | E122: of:=ABS([.B122])+ABS([.C122])+ABS([.D122]) -> 12
A123: 207 | B123: 2 | C123: -1 | D123: -9 | E123: of:=ABS([.B123])+ABS([.C123])+ABS([.D123]) -> 12
A124: 213 | B124: 6 | C124: -6 | D124: 0 | E124: of:=ABS([.B124])+ABS([.C124])+ABS([.D124]) -> 12
A125: 214 | B125: -1 | C125: -4 | D125: -7 | E125: of:=ABS([.B125])+ABS([.C125])+ABS([.D125]) -> 12
A126: 229 | B126: -1 | C126: -9 | D126: 2 | E126: of:=ABS([.B126])+ABS([.C126])+ABS([.D126]) -> 12
A127: 245 | B127: -11 | C127: 0 | D127: -1 | E127: of:=ABS([.B127])+ABS([.C127])+ABS([.D127]) -> 12
A128: 273 | B128: 2 | C128: -10 | D128: 0 | E128: of:=ABS([.B128])+ABS([.C128])+ABS([.D128]) -> 12
A129: 329 | B129: 1 | C129: -7 | D129: 4 | E129: of:=ABS([.B129])+ABS([.C129])+ABS([.D129]) -> 12
A130: 384 | B130: -1 | C130: 0 | D130: -11 | E130: of:=ABS([.B130])+ABS([.C130])+ABS([.D130]) -> 12
A131: 396 | B131: 7 | C131: -4 | D131: 1 | E131: of:=ABS([.B131])+ABS([.C131])+ABS([.D131]) -> 12
A132: 402 | B132: -9 | C132: 2 | D132: -1 | E132: of:=ABS([.B132])+ABS([.C132])+ABS([.D132]) -> 12
A133: 404 | B133: 2 | C133: -6 | D133: 4 | E133: of:=ABS([.B133])+ABS([.C133])+ABS([.D133]) -> 12
A134: 410 | B134: -1 | C134: -6 | D134: -5 | E134: of:=ABS([.B134])+ABS([.C134])+ABS([.D134]) -> 12
A135: 418 | B135: -5 | C135: -4 | D135: -3 | E135: of:=ABS([.B135])+ABS([.C135])+ABS([.D135]) -> 12
A136: 426 | B136: -3 | C136: -9 | D136: 0 | E136: of:=ABS([.B136])+ABS([.C136])+ABS([.D136]) -> 12
A137: 428 | B137: 2 | C137: 6 | D137: -4 | E137: of:=ABS([.B137])+ABS([.C137])+ABS([.D137]) -> 12
A138: 10 | B138: 4 | C138: 9 | D138: 0 | E138: of:=ABS([.B138])+ABS([.C138])+ABS([.D138]) -> 13
A139: 16 | B139: 4 | C139: -8 | D139: -1 | E139: of:=ABS([.B139])+ABS([.C139])+ABS([.D139]) -> 13
A140: 27 | B140: 0 | C140: 0 | D140: -13 | E140: of:=ABS([.B140])+ABS([.C140])+ABS([.D140]) -> 13
A141: 44 | B141: 7 | C141: 0 | D141: 6 | E141: of:=ABS([.B141])+ABS([.C141])+ABS([.D141]) -> 13
A142: 57 | B142: -9 | C142: 3 | D142: -1 | E142: of:=ABS([.B142])+ABS([.C142])+ABS([.D142]) -> 13
A143: 60 | B143: 5 | C143: 2 | D143: -6 | E143: of:=ABS([.B143])+ABS([.C143])+ABS([.D143]) -> 13
A144: 95 | B144: 4 | C144: -3 | D144: 6 | E144: of:=ABS([.B144])+ABS([.C144])+ABS([.D144]) -> 13
A145: 121 | B145: -4 | C145: 4 | D145: 5 | E145: of:=ABS([.B145])+ABS([.C145])+ABS([.D145]) -> 13
A146: 140 | B146: 1 | C146: -4 | D146: -8 | E146: of:=ABS([.B146])+ABS([.C146])+ABS([.D146]) -> 13
A147: 172 | B147: -4 | C147: 6 | D147: 3 | E147: of:=ABS([.B147])+ABS([.C147])+ABS([.D147]) -> 13
A148: 222 | B148: -5 | C148: 6 | D148: -2 | E148: of:=ABS([.B148])+ABS([.C148])+ABS([.D148]) -> 13
A149: 267 | B149: 3 | C149: -5 | D149: 5 | E149: of:=ABS([.B149])+ABS([.C149])+ABS([.D149]) -> 13
A150: 277 | B150: -3 | C150: 3 | D150: 7 | E150: of:=ABS([.B150])+ABS([.C150])+ABS([.D150]) -> 13
A151: 293 | B151: 1 | C151: -10 | D151: -2 | E151: of:=ABS([.B151])+ABS([.C151])+ABS([.D151]) -> 13
A152: 299 | B152: 6 | C152: 0 | D152: -7 | E152: of:=ABS([.B152])+ABS([.C152])+ABS([.D152]) -> 13
A153: 300 | B153: 2 | C153: -4 | D153: 7 | E153: of:=ABS([.B153])+ABS([.C153])+ABS([.D153]) -> 13
A154: 339 | B154: 10 | C154: 2 | D154: 1 | E154: of:=ABS([.B154])+ABS([.C154])+ABS([.D154]) -> 13
A155: 373 | B155: 3 | C155: 2 | D155: -8 | E155: of:=ABS([.B155])+ABS([.C155])+ABS([.D155]) -> 13
A156: 382 | B156: 2 | C156: 3 | D156: -8 | E156: of:=ABS([.B156])+ABS([.C156])+ABS([.D156]) -> 13
A157: 389 | B157: 10 | C157: 1 | D157: -2 | E157: of:=ABS([.B157])+ABS([.C157])+ABS([.D157]) -> 13
A158: 19 | B158: 4 | C158: -6 | D158: 4 | E158: of:=ABS([.B158])+ABS([.C158])+ABS([.D158]) -> 14
A159: 43 | B159: -5 | C159: 0 | D159: 9 | E159: of:=ABS([.B159])+ABS([.C159])+ABS([.D159]) -> 14
A160: 107 | B160: -3 | C160: -3 | D160: -8 | E160: of:=ABS([.B160])+ABS([.C160])+ABS([.D160]) -> 14
A161: 141 | B161: 7 | C161: 0 | D161: -7 | E161: of:=ABS([.B161])+ABS([.C161])+ABS([.D161]) -> 14
A162: 146 | B162: 4 | C162: -6 | D162: 4 | E162: of:=ABS([.B162])+ABS([.C162])+ABS([.D162]) -> 14
A163: 149 | B163: 11 | C163: -1 | D163: -2 | E163: of:=ABS([.B163])+ABS([.C163])+ABS([.D163]) -> 14
A164: 150 | B164: -1 | C164: -10 | D164: 3 | E164: of:=ABS([.B164])+ABS([.C164])+ABS([.D164]) -> 14
A165: 163 | B165: -7 | C165: 1 | D165: -6 | E165: of:=ABS([.B165])+ABS([.C165])+ABS([.D165]) -> 14
A166: 184 | B166: -1 | C166: -6 | D166: -7 | E166: of:=ABS([.B166])+ABS([.C166])+ABS([.D166]) -> 14
A167: 189 | B167: 5 | C167: 0 | D167: -9 | E167: of:=ABS([.B167])+ABS([.C167])+ABS([.D167]) -> 14
A168: 197 | B168: -6 | C168: -4 | D168: -4 | E168: of:=ABS([.B168])+ABS([.C168])+ABS([.D168]) -> 14
A169: 200 | B169: -5 | C169: 5 | D169: -4 | E169: of:=ABS([.B169])+ABS([.C169])+ABS([.D169]) -> 14
A170: 231 | B170: 6 | C170: -5 | D170: -3 | E170: of:=ABS([.B170])+ABS([.C170])+ABS([.D170]) -> 14
A171: 240 | B171: 3 | C171: -7 | D171: -4 | E171: of:=ABS([.B171])+ABS([.C171])+ABS([.D171]) -> 14
A172: 242 | B172: -5 | C172: 7 | D172: 2 | E172: of:=ABS([.B172])+ABS([.C172])+ABS([.D172]) -> 14
A173: 244 | B173: 3 | C173: 0 | D173: -11 | E173: of:=ABS([.B173])+ABS([.C173])+ABS([.D173]) -> 14
A174: 276 | B174: 7 | C174: 7 | D174: 0 | E174: of:=ABS([.B174])+ABS([.C174])+ABS([.D174]) -> 14
A175: 281 | B175: 0 | C175: 9 | D175: 5 | E175: of:=ABS([.B175])+ABS([.C175])+ABS([.D175]) -> 14
A176: 347 | B176: -9 | C176: 2 | D176: -3 | E176: of:=ABS([.B176])+ABS([.C176])+ABS([.D176]) -> 14
A177: 371 | B177: -5 | C177: -5 | D177: 4 | E177: of:=ABS([.B177])+ABS([.C177])+ABS([.D177]) -> 14
A178: 395 | B178: -9 | C178: -2 | D178: 3 | E178: of:=ABS([.B178])+ABS([.C178])+ABS([.D178]) -> 14
A179: 419 | B179: 1 | C179: -6 | D179: 7 | E179: of:=ABS([.B179])+ABS([.C179])+ABS([.D179]) -> 14
A180: 61 | B180: -9 | C180: -5 | D180: 1 | E180: of:=ABS([.B180])+ABS([.C180])+ABS([.D180]) -> 15
A181: 71 | B181: -5 | C181: -7 | D181: -3 | E181: of:=ABS([.B181])+ABS([.C181])+ABS([.D181]) -> 15
A182: 108 | B182: 2 | C182: -3 | D182: -10 | E182: of:=ABS([.B182])+ABS([.C182])+ABS([.D182]) -> 15
A183: 118 | B183: -4 | C183: 4 | D183: 7 | E183: of:=ABS([.B183])+ABS([.C183])+ABS([.D183]) -> 15
A184: 125 | B184: -1 | C184: -10 | D184: 4 | E184: of:=ABS([.B184])+ABS([.C184])+ABS([.D184]) -> 15
A185: 145 | B185: -4 | C185: -7 | D185: 4 | E185: of:=ABS([.B185])+ABS([.C185])+ABS([.D185]) -> 15
A186: 212 | B186: -5 | C186: -4 | D186: 6 | E186: of:=ABS([.B186])+ABS([.C186])+ABS([.D186]) -> 15
A187: 261 | B187: 6 | C187: -4 | D187: -5 | E187: of:=ABS([.B187])+ABS([.C187])+ABS([.D187]) -> 15
A188: 264 | B188: 10 | C188: -4 | D188: 1 | E188: of:=ABS([.B188])+ABS([.C188])+ABS([.D188]) -> 15
A189: 269 | B189: -2 | C189: 2 | D189: 11 | E189: of:=ABS([.B189])+ABS([.C189])+ABS([.D189]) -> 15
A190: 306 | B190: -6 | C190: 5 | D190: 4 | E190: of:=ABS([.B190])+ABS([.C190])+ABS([.D190]) -> 15
A191: 326 | B191: 6 | C191: -9 | D191: 0 | E191: of:=ABS([.B191])+ABS([.C191])+ABS([.D191]) -> 15
A192: 344 | B192: 4 | C192: -2 | D192: 9 | E192: of:=ABS([.B192])+ABS([.C192])+ABS([.D192]) -> 15
A193: 345 | B193: 0 | C193: 5 | D193: -10 | E193: of:=ABS([.B193])+ABS([.C193])+ABS([.D193]) -> 15
A194: 367 | B194: -7 | C194: 4 | D194: 4 | E194: of:=ABS([.B194])+ABS([.C194])+ABS([.D194]) -> 15
A195: 394 | B195: 7 | C195: -6 | D195: -2 | E195: of:=ABS([.B195])+ABS([.C195])+ABS([.D195]) -> 15
A196: 397 | B196: 0 | C196: -4 | D196: -11 | E196: of:=ABS([.B196])+ABS([.C196])+ABS([.D196]) -> 15
A197: 424 | B197: -7 | C197: 1 | D197: -7 | E197: of:=ABS([.B197])+ABS([.C197])+ABS([.D197]) -> 15
A198: 15 | B198: 11 | C198: -3 | D198: 2 | E198: of:=ABS([.B198])+ABS([.C198])+ABS([.D198]) -> 16
A199: 35 | B199: 4 | C199: -2 | D199: 10 | E199: of:=ABS([.B199])+ABS([.C199])+ABS([.D199]) -> 16
A200: 54 | B200: 1 | C200: 0 | D200: -15 | E200: of:=ABS([.B200])+ABS([.C200])+ABS([.D200]) -> 16
A201: 81 | B201: -7 | C201: 2 | D201: -7 | E201: of:=ABS([.B201])+ABS([.C201])+ABS([.D201]) -> 16
A202: 92 | B202: -6 | C202: 0 | D202: 10 | E202: of:=ABS([.B202])+ABS([.C202])+ABS([.D202]) -> 16
A203: 97 | B203: 6 | C203: -9 | D203: 1 | E203: of:=ABS([.B203])+ABS([.C203])+ABS([.D203]) -> 16
A204: 110 | B204: 8 | C204: -2 | D204: -6 | E204: of:=ABS([.B204])+ABS([.C204])+ABS([.D204]) -> 16
A205: 114 | B205: -10 | C205: 4 | D205: 2 | E205: of:=ABS([.B205])+ABS([.C205])+ABS([.D205]) -> 16
A206: 123 | B206: -8 | C206: -7 | D206: 1 | E206: of:=ABS([.B206])+ABS([.C206])+ABS([.D206]) -> 16
A207: 134 | B207: -2 | C207: 1 | D207: 13 | E207: of:=ABS([.B207])+ABS([.C207])+ABS([.D207]) -> 16
A208: 137 | B208: -4 | C208: 4 | D208: -8 | E208: of:=ABS([.B208])+ABS([.C208])+ABS([.D208]) -> 16
A209: 142 | B209: 4 | C209: 6 | D209: 6 | E209: of:=ABS([.B209])+ABS([.C209])+ABS([.D209]) -> 16
A210: 147 | B210: 10 | C210: 1 | D210: -5 | E210: of:=ABS([.B210])+ABS([.C210])+ABS([.D210]) -> 16
A211: 162 | B211: -1 | C211: 6 | D211: 9 | E211: of:=ABS([.B211])+ABS([.C211])+ABS([.D211]) -> 16
A212: 164 | B212: -2 | C212: -6 | D212: -8 | E212: of:=ABS([.B212])+ABS([.C212])+ABS([.D212]) -> 16
A213: 173 | B213: -4 | C213: 5 | D213: -7 | E213: of:=ABS([.B213])+ABS([.C213])+ABS([.D213]) -> 16
A214: 248 | B214: 11 | C214: 1 | D214: 4 | E214: of:=ABS([.B214])+ABS([.C214])+ABS([.D214]) -> 16
A215: 252 | B215: -3 | C215: -9 | D215: 4 | E215: of:=ABS([.B215])+ABS([.C215])+ABS([.D215]) -> 16
A216: 285 | B216: 0 | C216: -1 | D216: 15 | E216: of:=ABS([.B216])+ABS([.C216])+ABS([.D216]) -> 16
A217: 301 | B217: -12 | C217: -3 | D217: 1 | E217: of:=ABS([.B217])+ABS([.C217])+ABS([.D217]) -> 16
A218: 317 | B218: 13 | C218: 1 | D218: 2 | E218: of:=ABS([.B218])+ABS([.C218])+ABS([.D218]) -> 16
A219: 318 | B219: -3 | C219: 12 | D219: 1 | E219: of:=ABS([.B219])+ABS([.C219])+ABS([.D219]) -> 16
A220: 320 | B220: 1 | C220: 10 | D220: 5 | E220: of:=ABS([.B220])+ABS([.C220])+ABS([.D220]) -> 16
A221: 325 | B221: -3 | C221: -10 | D221: -3 | E221: of:=ABS([.B221])+ABS([.C221])+ABS([.D221]) -> 16
A222: 328 | B222: 9 | C222: -1 | D222: 6 | E222: of:=ABS([.B222])+ABS([.C222])+ABS([.D222]) -> 16
A223: 337 | B223: -3 | C223: -12 | D223: -1 | E223: of:=ABS([.B223])+ABS([.C223])+ABS([.D223]) -> 16
A224: 341 | B224: -7 | C224: -9 | D224: 0 | E224: of:=ABS([.B224])+ABS([.C224])+ABS([.D224]) -> 16
A225: 366 | B225: 6 | C225: 4 | D225: 6 | E225: of:=ABS([.B225])+ABS([.C225])+ABS([.D225]) -> 16
A226: 392 | B226: -4 | C226: -7 | D226: -5 | E226: of:=ABS([.B226])+ABS([.C226])+ABS([.D226]) -> 16
A227: 38 | B227: -6 | C227: -11 | D227: 0 | E227: of:=ABS([.B227])+ABS([.C227])+ABS([.D227]) -> 17
A228: 47 | B228: -10 | C228: 4 | D228: 3 | E228: of:=ABS([.B228])+ABS([.C228])+ABS([.D228]) -> 17
A229: 75 | B229: 4 | C229: -13 | D229: 0 | E229: of:=ABS([.B229])+ABS([.C229])+ABS([.D229]) -> 17
A230: 80 | B230: 11 | C230: 4 | D230: 2 | E230: of:=ABS([.B230])+ABS([.C230])+ABS([.D230]) -> 17
A231: 96 | B231: 7 | C231: -7 | D231: -3 | E231: of:=ABS([.B231])+ABS([.C231])+ABS([.D231]) -> 17
A232: 104 | B232: -5 | C232: -7 | D232: 5 | E232: of:=ABS([.B232])+ABS([.C232])+ABS([.D232]) -> 17
A233: 109 | B233: 0 | C233: -17 | D233: 0 | E233: of:=ABS([.B233])+ABS([.C233])+ABS([.D233]) -> 17
A234: 117 | B234: 3 | C234: -6 | D234: -8 | E234: of:=ABS([.B234])+ABS([.C234])+ABS([.D234]) -> 17
A235: 130 | B235: 9 | C235: -2 | D235: 6 | E235: of:=ABS([.B235])+ABS([.C235])+ABS([.D235]) -> 17
A236: 136 | B236: 7 | C236: 6 | D236: 4 | E236: of:=ABS([.B236])+ABS([.C236])+ABS([.D236]) -> 17
A237: 159 | B237: -4 | C237: -6 | D237: -7 | E237: of:=ABS([.B237])+ABS([.C237])+ABS([.D237]) -> 17
A238: 180 | B238: -15 | C238: 0 | D238: 2 | E238: of:=ABS([.B238])+ABS([.C238])+ABS([.D238]) -> 17
A239: 203 | B239: 2 | C239: 5 | D239: 10 | E239: of:=ABS([.B239])+ABS([.C239])+ABS([.D239]) -> 17
A240: 217 | B240: -1 | C240: 7 | D240: -9 | E240: of:=ABS([.B240])+ABS([.C240])+ABS([.D240]) -> 17
A241: 220 | B241: 9 | C241: 7 | D241: -1 | E241: of:=ABS([.B241])+ABS([.C241])+ABS([.D241]) -> 17
A242: 228 | B242: -4 | C242: 1 | D242: 12 | E242: of:=ABS([.B242])+ABS([.C242])+ABS([.D242]) -> 17
A243: 247 | B243: 11 | C243: 0 | D243: 6 | E243: of:=ABS([.B243])+ABS([.C243])+ABS([.D243]) -> 17
A244: 258 | B244: -15 | C244: 0 | D244: 2 | E244: of:=ABS([.B244])+ABS([.C244])+ABS([.D244]) -> 17
A245: 278 | B245: -3 | C245: 1 | D245: 13 | E245: of:=ABS([.B245])+ABS([.C245])+ABS([.D245]) -> 17
A246: 284 | B246: -7 | C246: 1 | D246: -9 | E246: of:=ABS([.B246])+ABS([.C246])+ABS([.D246]) -> 17
A247: 288 | B247: -2 | C247: 2 | D247: 13 | E247: of:=ABS([.B247])+ABS([.C247])+ABS([.D247]) -> 17
A248: 316 | B248: 2 | C248: 14 | D248: 1 | E248: of:=ABS([.B248])+ABS([.C248])+ABS([.D248]) -> 17
A249: 333 | B249: -15 | C249: 0 | D249: -2 | E249: of:=ABS([.B249])+ABS([.C249])+ABS([.D249]) -> 17
A250: 365 | B250: 0 | C250: 8 | D250: -9 | E250: of:=ABS([.B250])+ABS([.C250])+ABS([.D250]) -> 17
A251: 379 | B251: -7 | C251: 2 | D251: 8 | E251: of:=ABS([.B251])+ABS([.C251])+ABS([.D251]) -> 17
A252: 415 | B252: 9 | C252: 2 | D252: -6 | E252: of:=ABS([.B252])+ABS([.C252])+ABS([.D252]) -> 17
A253: 427 | B253: -6 | C253: 2 | D253: -9 | E253: of:=ABS([.B253])+ABS([.C253])+ABS([.D253]) -> 17
A254: 7 | B254: -14 | C254: -1 | D254: -3 | E254: of:=ABS([.B254])+ABS([.C254])+ABS([.D254]) -> 18
A255: 32 | B255: 3 | C255: -15 | D255: 0 | E255: of:=ABS([.B255])+ABS([.C255])+ABS([.D255]) -> 18
A256: 58 | B256: 3 | C256: 6 | D256: -9 | E256: of:=ABS([.B256])+ABS([.C256])+ABS([.D256]) -> 18
A257: 62 | B257: -8 | C257: 0 | D257: 10 | E257: of:=ABS([.B257])+ABS([.C257])+ABS([.D257]) -> 18
A258: 103 | B258: -6 | C258: 12 | D258: 0 | E258: of:=ABS([.B258])+ABS([.C258])+ABS([.D258]) -> 18
A259: 186 | B259: 2 | C259: -3 | D259: -13 | E259: of:=ABS([.B259])+ABS([.C259])+ABS([.D259]) -> 18
A260: 194 | B260: -1 | C260: 5 | D260: -12 | E260: of:=ABS([.B260])+ABS([.C260])+ABS([.D260]) -> 18
A261: 210 | B261: -11 | C261: 0 | D261: -7 | E261: of:=ABS([.B261])+ABS([.C261])+ABS([.D261]) -> 18
A262: 263 | B262: -2 | C262: 4 | D262: 12 | E262: of:=ABS([.B262])+ABS([.C262])+ABS([.D262]) -> 18
A263: 280 | B263: -16 | C263: 0 | D263: -2 | E263: of:=ABS([.B263])+ABS([.C263])+ABS([.D263]) -> 18
A264: 286 | B264: -9 | C264: 6 | D264: -3 | E264: of:=ABS([.B264])+ABS([.C264])+ABS([.D264]) -> 18
A265: 291 | B265: -4 | C265: 12 | D265: 2 | E265: of:=ABS([.B265])+ABS([.C265])+ABS([.D265]) -> 18
A266: 307 | B266: -11 | C266: 2 | D266: 5 | E266: of:=ABS([.B266])+ABS([.C266])+ABS([.D266]) -> 18
A267: 336 | B267: -12 | C267: -3 | D267: 3 | E267: of:=ABS([.B267])+ABS([.C267])+ABS([.D267]) -> 18
A268: 355 | B268: 10 | C268: 6 | D268: 2 | E268: of:=ABS([.B268])+ABS([.C268])+ABS([.D268]) -> 18
A269: 364 | B269: -3 | C269: -14 | D269: 1 | E269: of:=ABS([.B269])+ABS([.C269])+ABS([.D269]) -> 18
A270: 405 | B270: -7 | C270: 3 | D270: 8 | E270: of:=ABS([.B270])+ABS([.C270])+ABS([.D270]) -> 18
A271: 408 | B271: 7 | C271: -4 | D271: 7 | E271: of:=ABS([.B271])+ABS([.C271])+ABS([.D271]) -> 18
A272: 34 | B272: -13 | C272: 4 | D272: 2 | E272: of:=ABS([.B272])+ABS([.C272])+ABS([.D272]) -> 19
A273: 39 | B273: -4 | C273: -12 | D273: 3 | E273: of:=ABS([.B273])+ABS([.C273])+ABS([.D273]) -> 19
A274: 59 | B274: 12 | C274: -5 | D274: -2 | E274: of:=ABS([.B274])+ABS([.C274])+ABS([.D274]) -> 19
A275: 69 | B275: 6 | C275: 0 | D275: 13 | E275: of:=ABS([.B275])+ABS([.C275])+ABS([.D275]) -> 19
A276: 88 | B276: 12 | C276: 5 | D276: 2 | E276: of:=ABS([.B276])+ABS([.C276])+ABS([.D276]) -> 19
A277: 204 | B277: -10 | C277: -7 | D277: -2 | E277: of:=ABS([.B277])+ABS([.C277])+ABS([.D277]) -> 19
A278: 219 | B278: 11 | C278: -6 | D278: -2 | E278: of:=ABS([.B278])+ABS([.C278])+ABS([.D278]) -> 19
A279: 233 | B279: 7 | C279: 9 | D279: 3 | E279: of:=ABS([.B279])+ABS([.C279])+ABS([.D279]) -> 19
A280: 234 | B280: 4 | C280: -11 | D280: -4 | E280: of:=ABS([.B280])+ABS([.C280])+ABS([.D280]) -> 19
A281: 271 | B281: -4 | C281: -12 | D281: -3 | E281: of:=ABS([.B281])+ABS([.C281])+ABS([.D281]) -> 19
A282: 289 | B282: -9 | C282: -9 | D282: -1 | E282: of:=ABS([.B282])+ABS([.C282])+ABS([.D282]) -> 19
A283: 302 | B283: 0 | C283: -3 | D283: -16 | E283: of:=ABS([.B283])+ABS([.C283])+ABS([.D283]) -> 19
A284: 351 | B284: -12 | C284: -5 | D284: -2 | E284: of:=ABS([.B284])+ABS([.C284])+ABS([.D284]) -> 19
A285: 361 | B285: 5 | C285: -9 | D285: 5 | E285: of:=ABS([.B285])+ABS([.C285])+ABS([.D285]) -> 19
A286: 362 | B286: -13 | C286: 3 | D286: -3 | E286: of:=ABS([.B286])+ABS([.C286])+ABS([.D286]) -> 19
A287: 369 | B287: 3 | C287: 5 | D287: -11 | E287: of:=ABS([.B287])+ABS([.C287])+ABS([.D287]) -> 19
A288: 374 | B288: 6 | C288: 9 | D288: 4 | E288: of:=ABS([.B288])+ABS([.C288])+ABS([.D288]) -> 19
A289: 135 | B289: 11 | C289: 9 | D289: 0 | E289: of:=ABS([.B289])+ABS([.C289])+ABS([.D289]) -> 20
A290: 168 | B290: 4 | C290: -3 | D290: 13 | E290: of:=ABS([.B290])+ABS([.C290])+ABS([.D290]) -> 20
A291: 171 | B291: 8 | C291: 11 | D291: 1 | E291: of:=ABS([.B291])+ABS([.C291])+ABS([.D291]) -> 20
A292: 175 | B292: -3 | C292: -4 | D292: 13 | E292: of:=ABS([.B292])+ABS([.C292])+ABS([.D292]) -> 20
A293: 192 | B293: -1 | C293: 8 | D293: -11 | E293: of:=ABS([.B293])+ABS([.C293])+ABS([.D293]) -> 20
A294: 199 | B294: -14 | C294: -5 | D294: -1 | E294: of:=ABS([.B294])+ABS([.C294])+ABS([.D294]) -> 20
A295: 206 | B295: 1 | C295: -14 | D295: -5 | E295: of:=ABS([.B295])+ABS([.C295])+ABS([.D295]) -> 20
A296: 209 | B296: 6 | C296: -13 | D296: 1 | E296: of:=ABS([.B296])+ABS([.C296])+ABS([.D296]) -> 20
A297: 216 | B297: -4 | C297: -12 | D297: 4 | E297: of:=ABS([.B297])+ABS([.C297])+ABS([.D297]) -> 20
A298: 268 | B298: -9 | C298: 7 | D298: -4 | E298: of:=ABS([.B298])+ABS([.C298])+ABS([.D298]) -> 20
A299: 282 | B299: -12 | C299: -4 | D299: 4 | E299: of:=ABS([.B299])+ABS([.C299])+ABS([.D299]) -> 20
A300: 359 | B300: -8 | C300: -4 | D300: 8 | E300: of:=ABS([.B300])+ABS([.C300])+ABS([.D300]) -> 20
A301: 412 | B301: 8 | C301: -11 | D301: 1 | E301: of:=ABS([.B301])+ABS([.C301])+ABS([.D301]) -> 20
A302: 414 | B302: 9 | C302: -10 | D302: 1 | E302: of:=ABS([.B302])+ABS([.C302])+ABS([.D302]) -> 20
A303: 9 | B303: -4 | C303: 7 | D303: -10 | E303: of:=ABS([.B303])+ABS([.C303])+ABS([.D303]) -> 21
A304: 11 | B304: -7 | C304: 9 | D304: 5 | E304: of:=ABS([.B304])+ABS([.C304])+ABS([.D304]) -> 21
A305: 12 | B305: -3 | C305: 7 | D305: -11 | E305: of:=ABS([.B305])+ABS([.C305])+ABS([.D305]) -> 21
A306: 22 | B306: 1 | C306: -3 | D306: 17 | E306: of:=ABS([.B306])+ABS([.C306])+ABS([.D306]) -> 21
A307: 26 | B307: 7 | C307: 2 | D307: -12 | E307: of:=ABS([.B307])+ABS([.C307])+ABS([.D307]) -> 21
A308: 30 | B308: 10 | C308: -9 | D308: 2 | E308: of:=ABS([.B308])+ABS([.C308])+ABS([.D308]) -> 21
A309: 52 | B309: 3 | C309: -10 | D309: -8 | E309: of:=ABS([.B309])+ABS([.C309])+ABS([.D309]) -> 21
A310: 70 | B310: -7 | C310: 13 | D310: 1 | E310: of:=ABS([.B310])+ABS([.C310])+ABS([.D310]) -> 21
A311: 144 | B311: -15 | C311: -5 | D311: 1 | E311: of:=ABS([.B311])+ABS([.C311])+ABS([.D311]) -> 21
A312: 165 | B312: 10 | C312: 7 | D312: 4 | E312: of:=ABS([.B312])+ABS([.C312])+ABS([.D312]) -> 21
A313: 178 | B313: -20 | C313: 0 | D313: -1 | E313: of:=ABS([.B313])+ABS([.C313])+ABS([.D313]) -> 21
A314: 196 | B314: 3 | C314: -17 | D314: 1 | E314: of:=ABS([.B314])+ABS([.C314])+ABS([.D314]) -> 21
A315: 225 | B315: -14 | C315: -5 | D315: -2 | E315: of:=ABS([.B315])+ABS([.C315])+ABS([.D315]) -> 21
A316: 308 | B316: 3 | C316: -8 | D316: -10 | E316: of:=ABS([.B316])+ABS([.C316])+ABS([.D316]) -> 21
A317: 340 | B317: 6 | C317: -10 | D317: 5 | E317: of:=ABS([.B317])+ABS([.C317])+ABS([.D317]) -> 21
A318: 406 | B318: 7 | C318: -7 | D318: 7 | E318: of:=ABS([.B318])+ABS([.C318])+ABS([.D318]) -> 21
A319: 421 | B319: -14 | C319: -6 | D319: 1 | E319: of:=ABS([.B319])+ABS([.C319])+ABS([.D319]) -> 21
A320: 31 | B320: -8 | C320: 6 | D320: -8 | E320: of:=ABS([.B320])+ABS([.C320])+ABS([.D320]) -> 22
A321: 42 | B321: -13 | C321: 5 | D321: 4 | E321: of:=ABS([.B321])+ABS([.C321])+ABS([.D321]) -> 22
A322: 53 | B322: -11 | C322: -7 | D322: 4 | E322: of:=ABS([.B322])+ABS([.C322])+ABS([.D322]) -> 22
A323: 67 | B323: -4 | C323: -8 | D323: 10 | E323: of:=ABS([.B323])+ABS([.C323])+ABS([.D323]) -> 22
A324: 78 | B324: -17 | C324: 5 | D324: 0 | E324: of:=ABS([.B324])+ABS([.C324])+ABS([.D324]) -> 22
A325: 185 | B325: 3 | C325: 15 | D325: -4 | E325: of:=ABS([.B325])+ABS([.C325])+ABS([.D325]) -> 22
A326: 191 | B326: 14 | C326: 2 | D326: 6 | E326: of:=ABS([.B326])+ABS([.C326])+ABS([.D326]) -> 22
A327: 232 | B327: 8 | C327: -11 | D327: -3 | E327: of:=ABS([.B327])+ABS([.C327])+ABS([.D327]) -> 22
A328: 243 | B328: 2 | C328: -20 | D328: 0 | E328: of:=ABS([.B328])+ABS([.C328])+ABS([.D328]) -> 22
A329: 255 | B329: 4 | C329: 13 | D329: 5 | E329: of:=ABS([.B329])+ABS([.C329])+ABS([.D329]) -> 22
A330: 315 | B330: 8 | C330: -10 | D330: 4 | E330: of:=ABS([.B330])+ABS([.C330])+ABS([.D330]) -> 22
A331: 331 | B331: -10 | C331: -8 | D331: -4 | E331: of:=ABS([.B331])+ABS([.C331])+ABS([.D331]) -> 22
A332: 378 | B332: -14 | C332: 6 | D332: -2 | E332: of:=ABS([.B332])+ABS([.C332])+ABS([.D332]) -> 22
A333: 381 | B333: -1 | C333: -12 | D333: -9 | E333: of:=ABS([.B333])+ABS([.C333])+ABS([.D333]) -> 22
A334: 383 | B334: 6 | C334: 0 | D334: -16 | E334: of:=ABS([.B334])+ABS([.C334])+ABS([.D334]) -> 22
A335: 1 | B335: 11 | C335: 4 | D335: 8 | E335: of:=ABS([.B335])+ABS([.C335])+ABS([.D335]) -> 23
A336: 13 | B336: 13 | C336: -3 | D336: -7 | E336: of:=ABS([.B336])+ABS([.C336])+ABS([.D336]) -> 23
A337: 51 | B337: -3 | C337: -13 | D337: 7 | E337: of:=ABS([.B337])+ABS([.C337])+ABS([.D337]) -> 23
A338: 56 | B338: -5 | C338: 10 | D338: -8 | E338: of:=ABS([.B338])+ABS([.C338])+ABS([.D338]) -> 23
A339: 68 | B339: -18 | C339: 2 | D339: -3 | E339: of:=ABS([.B339])+ABS([.C339])+ABS([.D339]) -> 23
A340: 72 | B340: 5 | C340: -12 | D340: 6 | E340: of:=ABS([.B340])+ABS([.C340])+ABS([.D340]) -> 23
A341: 76 | B341: 7 | C341: -1 | D341: 15 | E341: of:=ABS([.B341])+ABS([.C341])+ABS([.D341]) -> 23
A342: 77 | B342: 8 | C342: -5 | D342: 10 | E342: of:=ABS([.B342])+ABS([.C342])+ABS([.D342]) -> 23
A343: 106 | B343: 2 | C343: 10 | D343: -11 | E343: of:=ABS([.B343])+ABS([.C343])+ABS([.D343]) -> 23
A344: 156 | B344: 6 | C344: 1 | D344: -16 | E344: of:=ABS([.B344])+ABS([.C344])+ABS([.D344]) -> 23
A345: 179 | B345: 9 | C345: 4 | D345: -10 | E345: of:=ABS([.B345])+ABS([.C345])+ABS([.D345]) -> 23
A346: 235 | B346: 14 | C346: -5 | D346: -4 | E346: of:=ABS([.B346])+ABS([.C346])+ABS([.D346]) -> 23
A347: 254 | B347: -5 | C347: -18 | D347: 0 | E347: of:=ABS([.B347])+ABS([.C347])+ABS([.D347]) -> 23
A348: 259 | B348: -4 | C348: 13 | D348: -6 | E348: of:=ABS([.B348])+ABS([.C348])+ABS([.D348]) -> 23
A349: 260 | B349: 2 | C349: 13 | D349: -8 | E349: of:=ABS([.B349])+ABS([.C349])+ABS([.D349]) -> 23
A350: 312 | B350: 4 | C350: -7 | D350: 12 | E350: of:=ABS([.B350])+ABS([.C350])+ABS([.D350]) -> 23
A351: 349 | B351: 3 | C351: 17 | D351: 3 | E351: of:=ABS([.B351])+ABS([.C351])+ABS([.D351]) -> 23
A352: 363 | B352: 13 | C352: 2 | D352: 8 | E352: of:=ABS([.B352])+ABS([.C352])+ABS([.D352]) -> 23
A353: 387 | B353: 9 | C353: 8 | D353: 6 | E353: of:=ABS([.B353])+ABS([.C353])+ABS([.D353]) -> 23
A354: 411 | B354: 7 | C354: 9 | D354: 7 | E354: of:=ABS([.B354])+ABS([.C354])+ABS([.D354]) -> 23
A355: 417 | B355: 13 | C355: -8 | D355: -2 | E355: of:=ABS([.B355])+ABS([.C355])+ABS([.D355]) -> 23
A356: 25 | B356: 4 | C356: -7 | D356: 13 | E356: of:=ABS([.B356])+ABS([.C356])+ABS([.D356]) -> 24
A357: 37 | B357: 0 | C357: 6 | D357: 18 | E357: of:=ABS([.B357])+ABS([.C357])+ABS([.D357]) -> 24
A358: 64 | B358: 10 | C358: -3 | D358: 11 | E358: of:=ABS([.B358])+ABS([.C358])+ABS([.D358]) -> 24
A359: 74 | B359: -2 | C359: 11 | D359: -11 | E359: of:=ABS([.B359])+ABS([.C359])+ABS([.D359]) -> 24
A360: 154 | B360: 11 | C360: 10 | D360: 3 | E360: of:=ABS([.B360])+ABS([.C360])+ABS([.D360]) -> 24
A361: 169 | B361: 6 | C361: -15 | D361: -3 | E361: of:=ABS([.B361])+ABS([.C361])+ABS([.D361]) -> 24
A362: 201 | B362: 16 | C362: -7 | D362: -1 | E362: of:=ABS([.B362])+ABS([.C362])+ABS([.D362]) -> 24
A363: 327 | B363: 6 | C363: -3 | D363: 15 | E363: of:=ABS([.B363])+ABS([.C363])+ABS([.D363]) -> 24
A364: 334 | B364: -11 | C364: 3 | D364: -10 | E364: of:=ABS([.B364])+ABS([.C364])+ABS([.D364]) -> 24
A365: 403 | B365: -12 | C365: 1 | D365: 11 | E365: of:=ABS([.B365])+ABS([.C365])+ABS([.D365]) -> 24
A366: 432 | B366: -17 | C366: -1 | D366: 6 | E366: of:=ABS([.B366])+ABS([.C366])+ABS([.D366]) -> 24
A367: 2 | B367: -10 | C367: -10 | D367: 5 | E367: of:=ABS([.B367])+ABS([.C367])+ABS([.D367]) -> 25
A368: 21 | B368: 3 | C368: -3 | D368: 19 | E368: of:=ABS([.B368])+ABS([.C368])+ABS([.D368]) -> 25
A369: 33 | B369: 5 | C369: -1 | D369: 19 | E369: of:=ABS([.B369])+ABS([.C369])+ABS([.D369]) -> 25
A370: 49 | B370: 8 | C370: -10 | D370: -7 | E370: of:=ABS([.B370])+ABS([.C370])+ABS([.D370]) -> 25
A371: 94 | B371: 0 | C371: -9 | D371: -16 | E371: of:=ABS([.B371])+ABS([.C371])+ABS([.D371]) -> 25
A372: 102 | B372: 12 | C372: 9 | D372: -4 | E372: of:=ABS([.B372])+ABS([.C372])+ABS([.D372]) -> 25
A373: 122 | B373: 11 | C373: -12 | D373: 2 | E373: of:=ABS([.B373])+ABS([.C373])+ABS([.D373]) -> 25
A374: 166 | B374: -12 | C374: -2 | D374: -11 | E374: of:=ABS([.B374])+ABS([.C374])+ABS([.D374]) -> 25
A375: 236 | B375: -5 | C375: -14 | D375: -6 | E375: of:=ABS([.B375])+ABS([.C375])+ABS([.D375]) -> 25
A376: 241 | B376: 3 | C376: 11 | D376: 11 | E376: of:=ABS([.B376])+ABS([.C376])+ABS([.D376]) -> 25
A377: 360 | B377: 14 | C377: 7 | D377: 4 | E377: of:=ABS([.B377])+ABS([.C377])+ABS([.D377]) -> 25
A378: 386 | B378: 1 | C378: 10 | D378: -14 | E378: of:=ABS([.B378])+ABS([.C378])+ABS([.D378]) -> 25
A379: 393 | B379: -7 | C379: 12 | D379: -6 | E379: of:=ABS([.B379])+ABS([.C379])+ABS([.D379]) -> 25
A380: 564 | B380: 0 | C380: -22 | D380: -3 | E380: of:=ABS([.B380])+ABS([.C380])+ABS([.D380]) -> 25
A381: 689 | B381: -20 | C381: 4 | D381: 1 | E381: of:=ABS([.B381])+ABS([.C381])+ABS([.D381]) -> 25
A382: 937 | B382: -4 | C382: 16 | D382: -5 | E382: of:=ABS([.B382])+ABS([.C382])+ABS([.D382]) -> 25
A383: 14 | B383: 4 | C383: 12 | D383: 10 | E383: of:=ABS([.B383])+ABS([.C383])+ABS([.D383]) -> 26
A384: 83 | B384: -8 | C384: 15 | D384: -3 | E384: of:=ABS([.B384])+ABS([.C384])+ABS([.D384]) -> 26
A385: 218 | B385: 4 | C385: -15 | D385: -7 | E385: of:=ABS([.B385])+ABS([.C385])+ABS([.D385]) -> 26
A386: 279 | B386: 13 | C386: -1 | D386: -12 | E386: of:=ABS([.B386])+ABS([.C386])+ABS([.D386]) -> 26
A387: 105 | B387: -9 | C387: 6 | D387: -12 | E387: of:=ABS([.B387])+ABS([.C387])+ABS([.D387]) -> 27
A388: 143 | B388: -5 | C388: 13 | D388: 9 | E388: of:=ABS([.B388])+ABS([.C388])+ABS([.D388]) -> 27
A389: 195 | B389: -9 | C389: 9 | D389: 9 | E389: of:=ABS([.B389])+ABS([.C389])+ABS([.D389]) -> 27
A390: 250 | B390: 17 | C390: -4 | D390: -6 | E390: of:=ABS([.B390])+ABS([.C390])+ABS([.D390]) -> 27
A391: 253 | B391: 2 | C391: 18 | D391: -7 | E391: of:=ABS([.B391])+ABS([.C391])+ABS([.D391]) -> 27
A392: 313 | B392: -14 | C392: -13 | D392: 0 | E392: of:=ABS([.B392])+ABS([.C392])+ABS([.D392]) -> 27
A393: 354 | B393: 10 | C393: 7 | D393: 10 | E393: of:=ABS([.B393])+ABS([.C393])+ABS([.D393]) -> 27
A394: 422 | B394: 9 | C394: 11 | D394: 7 | E394: of:=ABS([.B394])+ABS([.C394])+ABS([.D394]) -> 27
A395: 99 | B395: 12 | C395: 3 | D395: -13 | E395: of:=ABS([.B395])+ABS([.C395])+ABS([.D395]) -> 28
A396: 198 | B396: 5 | C396: 4 | D396: 19 | E396: of:=ABS([.B396])+ABS([.C396])+ABS([.D396]) -> 28
A397: 215 | B397: -8 | C397: -14 | D397: -6 | E397: of:=ABS([.B397])+ABS([.C397])+ABS([.D397]) -> 28
A398: 294 | B398: -1 | C398: -14 | D398: -13 | E398: of:=ABS([.B398])+ABS([.C398])+ABS([.D398]) -> 28
A399: 673 | B399: -1 | C399: 3 | D399: -24 | E399: of:=ABS([.B399])+ABS([.C399])+ABS([.D399]) -> 28
A400: 688 | B400: -20 | C400: -7 | D400: -1 | E400: of:=ABS([.B400])+ABS([.C400])+ABS([.D400]) -> 28
A401: 996 | B401: 1 | C401: -16 | D401: -11 | E401: of:=ABS([.B401])+ABS([.C401])+ABS([.D401]) -> 28
A402: 23 | B402: 5 | C402: -4 | D402: -20 | E402: of:=ABS([.B402])+ABS([.C402])+ABS([.D402]) -> 29
A403: 45 | B403: 16 | C403: -2 | D403: 11 | E403: of:=ABS([.B403])+ABS([.C403])+ABS([.D403]) -> 29
A404: 85 | B404: 2 | C404: 16 | D404: 11 | E404: of:=ABS([.B404])+ABS([.C404])+ABS([.D404]) -> 29
A405: 190 | B405: 14 | C405: 6 | D405: -9 | E405: of:=ABS([.B405])+ABS([.C405])+ABS([.D405]) -> 29
A406: 272 | B406: 18 | C406: 10 | D406: 1 | E406: of:=ABS([.B406])+ABS([.C406])+ABS([.D406]) -> 29
A407: 388 | B407: 13 | C407: 7 | D407: -9 | E407: of:=ABS([.B407])+ABS([.C407])+ABS([.D407]) -> 29
A408: 436 | B408: 21 | C408: -7 | D408: -1 | E408: of:=ABS([.B408])+ABS([.C408])+ABS([.D408]) -> 29
A409: 462 | B409: -2 | C409: -24 | D409: 3 | E409: of:=ABS([.B409])+ABS([.C409])+ABS([.D409]) -> 29
A410: 646 | B410: 0 | C410: 26 | D410: -3 | E410: of:=ABS([.B410])+ABS([.C410])+ABS([.D410]) -> 29
A411: 694 | B411: -1 | C411: -3 | D411: -25 | E411: of:=ABS([.B411])+ABS([.C411])+ABS([.D411]) -> 29
A412: 715 | B412: 0 | C412: -25 | D412: 4 | E412: of:=ABS([.B412])+ABS([.C412])+ABS([.D412]) -> 29
A413: 732 | B413: -4 | C413: 21 | D413: 4 | E413: of:=ABS([.B413])+ABS([.C413])+ABS([.D413]) -> 29
A414: 824 | B414: 0 | C414: 1 | D414: -28 | E414: of:=ABS([.B414])+ABS([.C414])+ABS([.D414]) -> 29
A415: 879 | B415: 23 | C415: 2 | D415: -4 | E415: of:=ABS([.B415])+ABS([.C415])+ABS([.D415]) -> 29
A416: 928 | B416: 27 | C416: -2 | D416: 0 | E416: of:=ABS([.B416])+ABS([.C416])+ABS([.D416]) -> 29
A417: 17 | B417: -11 | C417: 11 | D417: 8 | E417: of:=ABS([.B417])+ABS([.C417])+ABS([.D417]) -> 30
A418: 46 | B418: -5 | C418: -9 | D418: 16 | E418: of:=ABS([.B418])+ABS([.C418])+ABS([.D418]) -> 30
A419: 128 | B419: -19 | C419: 9 | D419: -2 | E419: of:=ABS([.B419])+ABS([.C419])+ABS([.D419]) -> 30
A420: 138 | B420: 11 | C420: 14 | D420: -5 | E420: of:=ABS([.B420])+ABS([.C420])+ABS([.D420]) -> 30
A421: 423 | B421: 12 | C421: 14 | D421: 4 | E421: of:=ABS([.B421])+ABS([.C421])+ABS([.D421]) -> 30
A422: 636 | B422: -3 | C422: -25 | D422: 2 | E422: of:=ABS([.B422])+ABS([.C422])+ABS([.D422]) -> 30
A423: 657 | B423: -3 | C423: -1 | D423: 26 | E423: of:=ABS([.B423])+ABS([.C423])+ABS([.D423]) -> 30
A424: 855 | B424: -15 | C424: -5 | D424: -10 | E424: of:=ABS([.B424])+ABS([.C424])+ABS([.D424]) -> 30
A425: 887 | B425: -1 | C425: 23 | D425: 6 | E425: of:=ABS([.B425])+ABS([.C425])+ABS([.D425]) -> 30
A426: 963 | B426: 17 | C426: 0 | D426: 13 | E426: of:=ABS([.B426])+ABS([.C426])+ABS([.D426]) -> 30
A427: 29 | B427: 9 | C427: -5 | D427: -17 | E427: of:=ABS([.B427])+ABS([.C427])+ABS([.D427]) -> 31
A428: 188 | B428: -14 | C428: 9 | D428: 8 | E428: of:=ABS([.B428])+ABS([.C428])+ABS([.D428]) -> 31
A429: 372 | B429: -4 | C429: -7 | D429: 20 | E429: of:=ABS([.B429])+ABS([.C429])+ABS([.D429]) -> 31
A430: 575 | B430: -26 | C430: -3 | D430: -2 | E430: of:=ABS([.B430])+ABS([.C430])+ABS([.D430]) -> 31
A431: 799 | B431: -4 | C431: 25 | D431: -2 | E431: of:=ABS([.B431])+ABS([.C431])+ABS([.D431]) -> 31
A432: 817 | B432: 27 | C432: -4 | D432: 0 | E432: of:=ABS([.B432])+ABS([.C432])+ABS([.D432]) -> 31
A433: 956 | B433: 1 | C433: 30 | D433: 0 | E433: of:=ABS([.B433])+ABS([.C433])+ABS([.D433]) -> 31
A434: 990 | B434: 17 | C434: -10 | D434: -4 | E434: of:=ABS([.B434])+ABS([.C434])+ABS([.D434]) -> 31
A435: 79 | B435: 12 | C435: -12 | D435: -8 | E435: of:=ABS([.B435])+ABS([.C435])+ABS([.D435]) -> 32
A436: 112 | B436: 2 | C436: 16 | D436: -14 | E436: of:=ABS([.B436])+ABS([.C436])+ABS([.D436]) -> 32
A437: 227 | B437: -9 | C437: -6 | D437: 17 | E437: of:=ABS([.B437])+ABS([.C437])+ABS([.D437]) -> 32
A438: 230 | B438: 8 | C438: 13 | D438: 11 | E438: of:=ABS([.B438])+ABS([.C438])+ABS([.D438]) -> 32
A439: 517 | B439: 7 | C439: 21 | D439: 4 | E439: of:=ABS([.B439])+ABS([.C439])+ABS([.D439]) -> 32
A440: 553 | B440: 3 | C440: -26 | D440: -3 | E440: of:=ABS([.B440])+ABS([.C440])+ABS([.D440]) -> 32
A441: 563 | B441: 1 | C441: 18 | D441: -13 | E441: of:=ABS([.B441])+ABS([.C441])+ABS([.D441]) -> 32
A442: 608 | B442: -14 | C442: 4 | D442: 14 | E442: of:=ABS([.B442])+ABS([.C442])+ABS([.D442]) -> 32
A443: 789 | B443: -1 | C443: 21 | D443: 10 | E443: of:=ABS([.B443])+ABS([.C443])+ABS([.D443]) -> 32
A444: 870 | B444: 26 | C444: 0 | D444: 6 | E444: of:=ABS([.B444])+ABS([.C444])+ABS([.D444]) -> 32
A445: 874 | B445: -25 | C445: 0 | D445: -7 | E445: of:=ABS([.B445])+ABS([.C445])+ABS([.D445]) -> 32
A446: 899 | B446: -4 | C446: 24 | D446: 4 | E446: of:=ABS([.B446])+ABS([.C446])+ABS([.D446]) -> 32
A447: 965 | B447: -22 | C447: -10 | D447: 0 | E447: of:=ABS([.B447])+ABS([.C447])+ABS([.D447]) -> 32
A448: 182 | B448: -15 | C448: 12 | D448: -6 | E448: of:=ABS([.B448])+ABS([.C448])+ABS([.D448]) -> 33
A449: 211 | B449: -11 | C449: 3 | D449: -19 | E449: of:=ABS([.B449])+ABS([.C449])+ABS([.D449]) -> 33
A450: 296 | B450: 16 | C450: -1 | D450: -16 | E450: of:=ABS([.B450])+ABS([.C450])+ABS([.D450]) -> 33
A451: 443 | B451: 0 | C451: -32 | D451: -1 | E451: of:=ABS([.B451])+ABS([.C451])+ABS([.D451]) -> 33
A452: 451 | B452: -3 | C452: -14 | D452: -16 | E452: of:=ABS([.B452])+ABS([.C452])+ABS([.D452]) -> 33
A453: 508 | B453: -26 | C453: 6 | D453: 1 | E453: of:=ABS([.B453])+ABS([.C453])+ABS([.D453]) -> 33
A454: 541 | B454: 7 | C454: -18 | D454: 8 | E454: of:=ABS([.B454])+ABS([.C454])+ABS([.D454]) -> 33
A455: 549 | B455: 21 | C455: 8 | D455: 4 | E455: of:=ABS([.B455])+ABS([.C455])+ABS([.D455]) -> 33
A456: 656 | B456: 16 | C456: -7 | D456: -10 | E456: of:=ABS([.B456])+ABS([.C456])+ABS([.D456]) -> 33
A457: 679 | B457: 5 | C457: 6 | D457: -22 | E457: of:=ABS([.B457])+ABS([.C457])+ABS([.D457]) -> 33
A458: 705 | B458: -4 | C458: -27 | D458: -2 | E458: of:=ABS([.B458])+ABS([.C458])+ABS([.D458]) -> 33
A459: 749 | B459: -3 | C459: 25 | D459: -5 | E459: of:=ABS([.B459])+ABS([.C459])+ABS([.D459]) -> 33
A460: 815 | B460: -4 | C460: -4 | D460: 25 | E460: of:=ABS([.B460])+ABS([.C460])+ABS([.D460]) -> 33
A461: 882 | B461: 0 | C461: -30 | D461: -3 | E461: of:=ABS([.B461])+ABS([.C461])+ABS([.D461]) -> 33
A462: 943 | B462: -2 | C462: 11 | D462: 20 | E462: of:=ABS([.B462])+ABS([.C462])+ABS([.D462]) -> 33
A463: 988 | B463: 10 | C463: 11 | D463: 12 | E463: of:=ABS([.B463])+ABS([.C463])+ABS([.D463]) -> 33
A464: 989 | B464: 5 | C464: 0 | D464: 28 | E464: of:=ABS([.B464])+ABS([.C464])+ABS([.D464]) -> 33
A465: 991 | B465: 2 | C465: 26 | D465: 5 | E465: of:=ABS([.B465])+ABS([.C465])+ABS([.D465]) -> 33
A466: 309 | B466: 14 | C466: 14 | D466: -6 | E466: of:=ABS([.B466])+ABS([.C466])+ABS([.D466]) -> 34
A467: 409 | B467: 8 | C467: 10 | D467: 16 | E467: of:=ABS([.B467])+ABS([.C467])+ABS([.D467]) -> 34
A468: 476 | B468: 5 | C468: 27 | D468: 2 | E468: of:=ABS([.B468])+ABS([.C468])+ABS([.D468]) -> 34
A469: 521 | B469: -3 | C469: -26 | D469: 5 | E469: of:=ABS([.B469])+ABS([.C469])+ABS([.D469]) -> 34
A470: 545 | B470: 23 | C470: 5 | D470: -6 | E470: of:=ABS([.B470])+ABS([.C470])+ABS([.D470]) -> 34
A471: 758 | B471: -16 | C471: 2 | D471: -16 | E471: of:=ABS([.B471])+ABS([.C471])+ABS([.D471]) -> 34
A472: 760 | B472: -3 | C472: 4 | D472: 27 | E472: of:=ABS([.B472])+ABS([.C472])+ABS([.D472]) -> 34
A473: 822 | B473: -5 | C473: -13 | D473: -16 | E473: of:=ABS([.B473])+ABS([.C473])+ABS([.D473]) -> 34
A474: 909 | B474: 2 | C474: -8 | D474: -24 | E474: of:=ABS([.B474])+ABS([.C474])+ABS([.D474]) -> 34
A475: 966 | B475: 3 | C475: 28 | D475: -3 | E475: of:=ABS([.B475])+ABS([.C475])+ABS([.D475]) -> 34
A476: 262 | B476: -10 | C476: -15 | D476: 10 | E476: of:=ABS([.B476])+ABS([.C476])+ABS([.D476]) -> 35
A477: 270 | B477: 17 | C477: -13 | D477: -5 | E477: of:=ABS([.B477])+ABS([.C477])+ABS([.D477]) -> 35
A478: 425 | B478: -15 | C478: 11 | D478: 9 | E478: of:=ABS([.B478])+ABS([.C478])+ABS([.D478]) -> 35
A479: 441 | B479: 28 | C479: 0 | D479: 7 | E479: of:=ABS([.B479])+ABS([.C479])+ABS([.D479]) -> 35
A480: 477 | B480: -18 | C480: 1 | D480: -16 | E480: of:=ABS([.B480])+ABS([.C480])+ABS([.D480]) -> 35
A481: 498 | B481: 4 | C481: 25 | D481: -6 | E481: of:=ABS([.B481])+ABS([.C481])+ABS([.D481]) -> 35
A482: 538 | B482: -22 | C482: -6 | D482: -7 | E482: of:=ABS([.B482])+ABS([.C482])+ABS([.D482]) -> 35
A483: 664 | B483: -13 | C483: 1 | D483: -21 | E483: of:=ABS([.B483])+ABS([.C483])+ABS([.D483]) -> 35
A484: 840 | B484: -19 | C484: 16 | D484: 0 | E484: of:=ABS([.B484])+ABS([.C484])+ABS([.D484]) -> 35
A485: 845 | B485: 10 | C485: -23 | D485: -2 | E485: of:=ABS([.B485])+ABS([.C485])+ABS([.D485]) -> 35
A486: 893 | B486: -6 | C486: -28 | D486: 1 | E486: of:=ABS([.B486])+ABS([.C486])+ABS([.D486]) -> 35
A487: 98 | B487: 5 | C487: -15 | D487: -16 | E487: of:=ABS([.B487])+ABS([.C487])+ABS([.D487]) -> 36
A488: 239 | B488: -14 | C488: -13 | D488: -9 | E488: of:=ABS([.B488])+ABS([.C488])+ABS([.D488]) -> 36
A489: 335 | B489: 13 | C489: -22 | D489: 1 | E489: of:=ABS([.B489])+ABS([.C489])+ABS([.D489]) -> 36
A490: 452 | B490: 23 | C490: -1 | D490: 12 | E490: of:=ABS([.B490])+ABS([.C490])+ABS([.D490]) -> 36
A491: 455 | B491: -7 | C491: 6 | D491: -23 | E491: of:=ABS([.B491])+ABS([.C491])+ABS([.D491]) -> 36
A492: 461 | B492: 3 | C492: -28 | D492: 5 | E492: of:=ABS([.B492])+ABS([.C492])+ABS([.D492]) -> 36
A493: 528 | B493: 1 | C493: -8 | D493: 27 | E493: of:=ABS([.B493])+ABS([.C493])+ABS([.D493]) -> 36
A494: 570 | B494: 0 | C494: 9 | D494: 27 | E494: of:=ABS([.B494])+ABS([.C494])+ABS([.D494]) -> 36
A495: 572 | B495: 7 | C495: 28 | D495: -1 | E495: of:=ABS([.B495])+ABS([.C495])+ABS([.D495]) -> 36
A496: 591 | B496: -13 | C496: -19 | D496: 4 | E496: of:=ABS([.B496])+ABS([.C496])+ABS([.D496]) -> 36
A497: 602 | B497: 22 | C497: 3 | D497: 11 | E497: of:=ABS([.B497])+ABS([.C497])+ABS([.D497]) -> 36
A498: 649 | B498: -13 | C498: 0 | D498: -23 | E498: of:=ABS([.B498])+ABS([.C498])+ABS([.D498]) -> 36
A499: 711 | B499: 11 | C499: 14 | D499: -11 | E499: of:=ABS([.B499])+ABS([.C499])+ABS([.D499]) -> 36
A500: 714 | B500: 2 | C500: -27 | D500: -7 | E500: of:=ABS([.B500])+ABS([.C500])+ABS([.D500]) -> 36
A501: 729 | B501: -1 | C501: -18 | D501: -17 | E501: of:=ABS([.B501])+ABS([.C501])+ABS([.D501]) -> 36
A502: 736 | B502: -10 | C502: -20 | D502: -6 | E502: of:=ABS([.B502])+ABS([.C502])+ABS([.D502]) -> 36
A503: 768 | B503: -31 | C503: 3 | D503: 2 | E503: of:=ABS([.B503])+ABS([.C503])+ABS([.D503]) -> 36
A504: 778 | B504: -1 | C504: 14 | D504: -21 | E504: of:=ABS([.B504])+ABS([.C504])+ABS([.D504]) -> 36
A505: 810 | B505: 1 | C505: 18 | D505: -17 | E505: of:=ABS([.B505])+ABS([.C505])+ABS([.D505]) -> 36
A506: 837 | B506: 17 | C506: 1 | D506: 18 | E506: of:=ABS([.B506])+ABS([.C506])+ABS([.D506]) -> 36
A507: 400 | B507: -14 | C507: -8 | D507: -15 | E507: of:=ABS([.B507])+ABS([.C507])+ABS([.D507]) -> 37
A508: 621 | B508: -6 | C508: -7 | D508: -24 | E508: of:=ABS([.B508])+ABS([.C508])+ABS([.D508]) -> 37
A509: 625 | B509: -14 | C509: 0 | D509: 23 | E509: of:=ABS([.B509])+ABS([.C509])+ABS([.D509]) -> 37
A510: 642 | B510: 28 | C510: -5 | D510: -4 | E510: of:=ABS([.B510])+ABS([.C510])+ABS([.D510]) -> 37
A511: 671 | B511: 21 | C511: -1 | D511: 15 | E511: of:=ABS([.B511])+ABS([.C511])+ABS([.D511]) -> 37
A512: 744 | B512: 32 | C512: 2 | D512: 3 | E512: of:=ABS([.B512])+ABS([.C512])+ABS([.D512]) -> 37
A513: 803 | B513: -18 | C513: -2 | D513: -17 | E513: of:=ABS([.B513])+ABS([.C513])+ABS([.D513]) -> 37
A514: 829 | B514: 12 | C514: -1 | D514: -24 | E514: of:=ABS([.B514])+ABS([.C514])+ABS([.D514]) -> 37
A515: 860 | B515: 21 | C515: -11 | D515: 5 | E515: of:=ABS([.B515])+ABS([.C515])+ABS([.D515]) -> 37
A516: 868 | B516: 3 | C516: 0 | D516: 34 | E516: of:=ABS([.B516])+ABS([.C516])+ABS([.D516]) -> 37
A517: 881 | B517: -22 | C517: -9 | D517: -6 | E517: of:=ABS([.B517])+ABS([.C517])+ABS([.D517]) -> 37
A518: 916 | B518: -32 | C518: 5 | D518: 0 | E518: of:=ABS([.B518])+ABS([.C518])+ABS([.D518]) -> 37
A519: 926 | B519: -24 | C519: 3 | D519: 10 | E519: of:=ABS([.B519])+ABS([.C519])+ABS([.D519]) -> 37
A520: 961 | B520: -6 | C520: 7 | D520: -24 | E520: of:=ABS([.B520])+ABS([.C520])+ABS([.D520]) -> 37
A521: 973 | B521: 33 | C521: 3 | D521: -1 | E521: of:=ABS([.B521])+ABS([.C521])+ABS([.D521]) -> 37
A522: 976 | B522: 6 | C522: 29 | D522: -2 | E522: of:=ABS([.B522])+ABS([.C522])+ABS([.D522]) -> 37
A523: 982 | B523: -2 | C523: -12 | D523: 23 | E523: of:=ABS([.B523])+ABS([.C523])+ABS([.D523]) -> 37
A524: 995 | B524: 11 | C524: -13 | D524: 13 | E524: of:=ABS([.B524])+ABS([.C524])+ABS([.D524]) -> 37
A525: 290 | B525: -18 | C525: 12 | D525: -8 | E525: of:=ABS([.B525])+ABS([.C525])+ABS([.D525]) -> 38
A526: 434 | B526: -11 | C526: 0 | D526: -27 | E526: of:=ABS([.B526])+ABS([.C526])+ABS([.D526]) -> 38
A527: 453 | B527: -14 | C527: 6 | D527: 18 | E527: of:=ABS([.B527])+ABS([.C527])+ABS([.D527]) -> 38
A528: 465 | B528: 27 | C528: 9 | D528: -2 | E528: of:=ABS([.B528])+ABS([.C528])+ABS([.D528]) -> 38
A529: 486 | B529: -8 | C529: -25 | D529: 5 | E529: of:=ABS([.B529])+ABS([.C529])+ABS([.D529]) -> 38
A530: 604 | B530: 0 | C530: -15 | D530: -23 | E530: of:=ABS([.B530])+ABS([.C530])+ABS([.D530]) -> 38
A531: 616 | B531: -12 | C531: -6 | D531: 20 | E531: of:=ABS([.B531])+ABS([.C531])+ABS([.D531]) -> 38
A532: 647 | B532: -15 | C532: 10 | D532: 13 | E532: of:=ABS([.B532])+ABS([.C532])+ABS([.D532]) -> 38
A533: 658 | B533: -13 | C533: 3 | D533: -22 | E533: of:=ABS([.B533])+ABS([.C533])+ABS([.D533]) -> 38
A534: 687 | B534: 20 | C534: 4 | D534: 14 | E534: of:=ABS([.B534])+ABS([.C534])+ABS([.D534]) -> 38
A535: 708 | B535: 4 | C535: 26 | D535: 8 | E535: of:=ABS([.B535])+ABS([.C535])+ABS([.D535]) -> 38
A536: 728 | B536: 13 | C536: 13 | D536: -12 | E536: of:=ABS([.B536])+ABS([.C536])+ABS([.D536]) -> 38
A537: 739 | B537: -7 | C537: -21 | D537: 10 | E537: of:=ABS([.B537])+ABS([.C537])+ABS([.D537]) -> 38
A538: 814 | B538: 4 | C538: -18 | D538: 16 | E538: of:=ABS([.B538])+ABS([.C538])+ABS([.D538]) -> 38
A539: 865 | B539: -10 | C539: 27 | D539: -1 | E539: of:=ABS([.B539])+ABS([.C539])+ABS([.D539]) -> 38
A540: 884 | B540: 10 | C540: -1 | D540: -27 | E540: of:=ABS([.B540])+ABS([.C540])+ABS([.D540]) -> 38
A541: 905 | B541: -11 | C541: 6 | D541: 21 | E541: of:=ABS([.B541])+ABS([.C541])+ABS([.D541]) -> 38
A542: 906 | B542: -2 | C542: -34 | D542: 2 | E542: of:=ABS([.B542])+ABS([.C542])+ABS([.D542]) -> 38
A543: 918 | B543: -14 | C543: 5 | D543: -19 | E543: of:=ABS([.B543])+ABS([.C543])+ABS([.D543]) -> 38
A544: 938 | B544: 7 | C544: 7 | D544: -24 | E544: of:=ABS([.B544])+ABS([.C544])+ABS([.D544]) -> 38
A545: 992 | B545: -4 | C545: 8 | D545: 26 | E545: of:=ABS([.B545])+ABS([.C545])+ABS([.D545]) -> 38
A546: 440 | B546: -32 | C546: 0 | D546: -7 | E546: of:=ABS([.B546])+ABS([.C546])+ABS([.D546]) -> 39
A547: 459 | B547: 3 | C547: -25 | D547: -11 | E547: of:=ABS([.B547])+ABS([.C547])+ABS([.D547]) -> 39
A548: 468 | B548: -14 | C548: -4 | D548: -21 | E548: of:=ABS([.B548])+ABS([.C548])+ABS([.D548]) -> 39
A549: 470 | B549: -5 | C549: -1 | D549: 33 | E549: of:=ABS([.B549])+ABS([.C549])+ABS([.D549]) -> 39
A550: 519 | B550: -3 | C550: -22 | D550: -14 | E550: of:=ABS([.B550])+ABS([.C550])+ABS([.D550]) -> 39
A551: 539 | B551: -5 | C551: 29 | D551: -5 | E551: of:=ABS([.B551])+ABS([.C551])+ABS([.D551]) -> 39
A552: 548 | B552: 8 | C552: -29 | D552: -2 | E552: of:=ABS([.B552])+ABS([.C552])+ABS([.D552]) -> 39
A553: 576 | B553: 2 | C553: -8 | D553: 29 | E553: of:=ABS([.B553])+ABS([.C553])+ABS([.D553]) -> 39
A554: 606 | B554: 4 | C554: -5 | D554: -30 | E554: of:=ABS([.B554])+ABS([.C554])+ABS([.D554]) -> 39
A555: 650 | B555: -4 | C555: 24 | D555: 11 | E555: of:=ABS([.B555])+ABS([.C555])+ABS([.D555]) -> 39
A556: 654 | B556: 13 | C556: -14 | D556: -12 | E556: of:=ABS([.B556])+ABS([.C556])+ABS([.D556]) -> 39
A557: 678 | B557: 29 | C557: 8 | D557: -2 | E557: of:=ABS([.B557])+ABS([.C557])+ABS([.D557]) -> 39
A558: 695 | B558: 5 | C558: -26 | D558: -8 | E558: of:=ABS([.B558])+ABS([.C558])+ABS([.D558]) -> 39
A559: 718 | B559: 28 | C559: -8 | D559: -3 | E559: of:=ABS([.B559])+ABS([.C559])+ABS([.D559]) -> 39
A560: 725 | B560: 22 | C560: 10 | D560: 7 | E560: of:=ABS([.B560])+ABS([.C560])+ABS([.D560]) -> 39
A561: 738 | B561: -23 | C561: 14 | D561: 2 | E561: of:=ABS([.B561])+ABS([.C561])+ABS([.D561]) -> 39
A562: 785 | B562: -16 | C562: 22 | D562: 1 | E562: of:=ABS([.B562])+ABS([.C562])+ABS([.D562]) -> 39
A563: 790 | B563: 23 | C563: -6 | D563: 10 | E563: of:=ABS([.B563])+ABS([.C563])+ABS([.D563]) -> 39
A564: 818 | B564: -21 | C564: 6 | D564: -12 | E564: of:=ABS([.B564])+ABS([.C564])+ABS([.D564]) -> 39
A565: 821 | B565: -2 | C565: -17 | D565: -20 | E565: of:=ABS([.B565])+ABS([.C565])+ABS([.D565]) -> 39
A566: 823 | B566: 9 | C566: 16 | D566: 14 | E566: of:=ABS([.B566])+ABS([.C566])+ABS([.D566]) -> 39
A567: 842 | B567: -4 | C567: -26 | D567: -9 | E567: of:=ABS([.B567])+ABS([.C567])+ABS([.D567]) -> 39
A568: 856 | B568: 11 | C568: 17 | D568: 11 | E568: of:=ABS([.B568])+ABS([.C568])+ABS([.D568]) -> 39
A569: 862 | B569: 3 | C569: 7 | D569: -29 | E569: of:=ABS([.B569])+ABS([.C569])+ABS([.D569]) -> 39
A570: 923 | B570: -12 | C570: -20 | D570: -7 | E570: of:=ABS([.B570])+ABS([.C570])+ABS([.D570]) -> 39
A571: 947 | B571: 26 | C571: 6 | D571: -7 | E571: of:=ABS([.B571])+ABS([.C571])+ABS([.D571]) -> 39
A572: 967 | B572: -8 | C572: 4 | D572: 27 | E572: of:=ABS([.B572])+ABS([.C572])+ABS([.D572]) -> 39
A573: 971 | B573: -11 | C573: 0 | D573: 28 | E573: of:=ABS([.B573])+ABS([.C573])+ABS([.D573]) -> 39
A574: 978 | B574: 22 | C574: 16 | D574: 1 | E574: of:=ABS([.B574])+ABS([.C574])+ABS([.D574]) -> 39
A575: 202 | B575: -12 | C575: -14 | D575: 14 | E575: of:=ABS([.B575])+ABS([.C575])+ABS([.D575]) -> 40
A576: 442 | B576: 30 | C576: 1 | D576: 9 | E576: of:=ABS([.B576])+ABS([.C576])+ABS([.D576]) -> 40
A577: 493 | B577: -7 | C577: 6 | D577: -27 | E577: of:=ABS([.B577])+ABS([.C577])+ABS([.D577]) -> 40
A578: 524 | B578: -6 | C578: -28 | D578: -6 | E578: of:=ABS([.B578])+ABS([.C578])+ABS([.D578]) -> 40
A579: 546 | B579: -30 | C579: 9 | D579: -1 | E579: of:=ABS([.B579])+ABS([.C579])+ABS([.D579]) -> 40
A580: 566 | B580: -28 | C580: -9 | D580: -3 | E580: of:=ABS([.B580])+ABS([.C580])+ABS([.D580]) -> 40
A581: 611 | B581: 10 | C581: -1 | D581: 29 | E581: of:=ABS([.B581])+ABS([.C581])+ABS([.D581]) -> 40
A582: 710 | B582: 0 | C582: -28 | D582: 12 | E582: of:=ABS([.B582])+ABS([.C582])+ABS([.D582]) -> 40
A583: 720 | B583: -17 | C583: -19 | D583: 4 | E583: of:=ABS([.B583])+ABS([.C583])+ABS([.D583]) -> 40
A584: 730 | B584: -2 | C584: 26 | D584: 12 | E584: of:=ABS([.B584])+ABS([.C584])+ABS([.D584]) -> 40
A585: 745 | B585: 26 | C585: -11 | D585: -3 | E585: of:=ABS([.B585])+ABS([.C585])+ABS([.D585]) -> 40
A586: 757 | B586: -28 | C586: 9 | D586: -3 | E586: of:=ABS([.B586])+ABS([.C586])+ABS([.D586]) -> 40
A587: 781 | B587: 17 | C587: -18 | D587: 5 | E587: of:=ABS([.B587])+ABS([.C587])+ABS([.D587]) -> 40
A588: 812 | B588: -2 | C588: -25 | D588: 13 | E588: of:=ABS([.B588])+ABS([.C588])+ABS([.D588]) -> 40
A589: 864 | B589: -9 | C589: -8 | D589: -23 | E589: of:=ABS([.B589])+ABS([.C589])+ABS([.D589]) -> 40
A590: 880 | B590: 5 | C590: -8 | D590: 27 | E590: of:=ABS([.B590])+ABS([.C590])+ABS([.D590]) -> 40
A591: 898 | B591: -28 | C591: 5 | D591: -7 | E591: of:=ABS([.B591])+ABS([.C591])+ABS([.D591]) -> 40
A592: 948 | B592: -27 | C592: -5 | D592: -8 | E592: of:=ABS([.B592])+ABS([.C592])+ABS([.D592]) -> 40
A593: 174 | B593: 6 | C593: -22 | D593: -13 | E593: of:=ABS([.B593])+ABS([.C593])+ABS([.D593]) -> 41
A594: 554 | B594: 9 | C594: -20 | D594: -12 | E594: of:=ABS([.B594])+ABS([.C594])+ABS([.D594]) -> 41
A595: 595 | B595: 5 | C595: -10 | D595: 26 | E595: of:=ABS([.B595])+ABS([.C595])+ABS([.D595]) -> 41
A596: 613 | B596: -25 | C596: 15 | D596: 1 | E596: of:=ABS([.B596])+ABS([.C596])+ABS([.D596]) -> 41
A597: 628 | B597: -19 | C597: -12 | D597: -10 | E597: of:=ABS([.B597])+ABS([.C597])+ABS([.D597]) -> 41
A598: 632 | B598: 19 | C598: -3 | D598: -19 | E598: of:=ABS([.B598])+ABS([.C598])+ABS([.D598]) -> 41
A599: 641 | B599: -21 | C599: -7 | D599: 13 | E599: of:=ABS([.B599])+ABS([.C599])+ABS([.D599]) -> 41
A600: 652 | B600: -18 | C600: -2 | D600: 21 | E600: of:=ABS([.B600])+ABS([.C600])+ABS([.D600]) -> 41
A601: 661 | B601: 13 | C601: -7 | D601: 21 | E601: of:=ABS([.B601])+ABS([.C601])+ABS([.D601]) -> 41
A602: 693 | B602: 23 | C602: -16 | D602: 2 | E602: of:=ABS([.B602])+ABS([.C602])+ABS([.D602]) -> 41
A603: 723 | B603: 20 | C603: 18 | D603: -3 | E603: of:=ABS([.B603])+ABS([.C603])+ABS([.D603]) -> 41
A604: 805 | B604: 3 | C604: 9 | D604: 29 | E604: of:=ABS([.B604])+ABS([.C604])+ABS([.D604]) -> 41
A605: 838 | B605: -8 | C605: -10 | D605: 23 | E605: of:=ABS([.B605])+ABS([.C605])+ABS([.D605]) -> 41
A606: 848 | B606: 6 | C606: -29 | D606: -6 | E606: of:=ABS([.B606])+ABS([.C606])+ABS([.D606]) -> 41
A607: 891 | B607: -7 | C607: 11 | D607: 23 | E607: of:=ABS([.B607])+ABS([.C607])+ABS([.D607]) -> 41
A608: 927 | B608: 11 | C608: -22 | D608: 8 | E608: of:=ABS([.B608])+ABS([.C608])+ABS([.D608]) -> 41
A609: 929 | B609: 30 | C609: -4 | D609: 7 | E609: of:=ABS([.B609])+ABS([.C609])+ABS([.D609]) -> 41
A610: 935 | B610: -6 | C610: -27 | D610: 8 | E610: of:=ABS([.B610])+ABS([.C610])+ABS([.D610]) -> 41
A611: 994 | B611: -3 | C611: -29 | D611: -9 | E611: of:=ABS([.B611])+ABS([.C611])+ABS([.D611]) -> 41
A612: 454 | B612: -30 | C612: -11 | D612: 1 | E612: of:=ABS([.B612])+ABS([.C612])+ABS([.D612]) -> 42
A613: 464 | B613: -17 | C613: 20 | D613: 5 | E613: of:=ABS([.B613])+ABS([.C613])+ABS([.D613]) -> 42
A614: 469 | B614: 27 | C614: 11 | D614: -4 | E614: of:=ABS([.B614])+ABS([.C614])+ABS([.D614]) -> 42
A615: 474 | B615: -27 | C615: 6 | D615: 9 | E615: of:=ABS([.B615])+ABS([.C615])+ABS([.D615]) -> 42
A616: 491 | B616: 5 | C616: -9 | D616: -28 | E616: of:=ABS([.B616])+ABS([.C616])+ABS([.D616]) -> 42
A617: 507 | B617: -9 | C617: 15 | D617: 18 | E617: of:=ABS([.B617])+ABS([.C617])+ABS([.D617]) -> 42
A618: 534 | B618: 20 | C618: -1 | D618: -21 | E618: of:=ABS([.B618])+ABS([.C618])+ABS([.D618]) -> 42
A619: 537 | B619: 29 | C619: -10 | D619: 3 | E619: of:=ABS([.B619])+ABS([.C619])+ABS([.D619]) -> 42
A620: 579 | B620: 0 | C620: -12 | D620: 30 | E620: of:=ABS([.B620])+ABS([.C620])+ABS([.D620]) -> 42
A621: 580 | B621: 11 | C621: 3 | D621: -28 | E621: of:=ABS([.B621])+ABS([.C621])+ABS([.D621]) -> 42
A622: 631 | B622: 38 | C622: -2 | D622: 2 | E622: of:=ABS([.B622])+ABS([.C622])+ABS([.D622]) -> 42
A623: 640 | B623: -21 | C623: -18 | D623: -3 | E623: of:=ABS([.B623])+ABS([.C623])+ABS([.D623]) -> 42
A624: 682 | B624: 12 | C624: -8 | D624: -22 | E624: of:=ABS([.B624])+ABS([.C624])+ABS([.D624]) -> 42
A625: 709 | B625: -31 | C625: 5 | D625: -6 | E625: of:=ABS([.B625])+ABS([.C625])+ABS([.D625]) -> 42
A626: 713 | B626: 6 | C626: -28 | D626: 8 | E626: of:=ABS([.B626])+ABS([.C626])+ABS([.D626]) -> 42
A627: 747 | B627: -9 | C627: 27 | D627: 6 | E627: of:=ABS([.B627])+ABS([.C627])+ABS([.D627]) -> 42
A628: 750 | B628: -27 | C628: -9 | D628: 6 | E628: of:=ABS([.B628])+ABS([.C628])+ABS([.D628]) -> 42
A629: 775 | B629: 0 | C629: -23 | D629: -19 | E629: of:=ABS([.B629])+ABS([.C629])+ABS([.D629]) -> 42
A630: 804 | B630: -18 | C630: -15 | D630: -9 | E630: of:=ABS([.B630])+ABS([.C630])+ABS([.D630]) -> 42
A631: 809 | B631: 6 | C631: -19 | D631: -17 | E631: of:=ABS([.B631])+ABS([.C631])+ABS([.D631]) -> 42
A632: 813 | B632: -2 | C632: 21 | D632: -19 | E632: of:=ABS([.B632])+ABS([.C632])+ABS([.D632]) -> 42
A633: 833 | B633: 9 | C633: 19 | D633: -14 | E633: of:=ABS([.B633])+ABS([.C633])+ABS([.D633]) -> 42
A634: 835 | B634: -11 | C634: 7 | D634: -24 | E634: of:=ABS([.B634])+ABS([.C634])+ABS([.D634]) -> 42
A635: 843 | B635: 37 | C635: -1 | D635: -4 | E635: of:=ABS([.B635])+ABS([.C635])+ABS([.D635]) -> 42
A636: 851 | B636: -5 | C636: 20 | D636: -17 | E636: of:=ABS([.B636])+ABS([.C636])+ABS([.D636]) -> 42
A637: 853 | B637: -13 | C637: -26 | D637: 3 | E637: of:=ABS([.B637])+ABS([.C637])+ABS([.D637]) -> 42
A638: 873 | B638: -13 | C638: 28 | D638: 1 | E638: of:=ABS([.B638])+ABS([.C638])+ABS([.D638]) -> 42
A639: 877 | B639: -14 | C639: -16 | D639: 12 | E639: of:=ABS([.B639])+ABS([.C639])+ABS([.D639]) -> 42
A640: 896 | B640: 34 | C640: 4 | D640: -4 | E640: of:=ABS([.B640])+ABS([.C640])+ABS([.D640]) -> 42
A641: 914 | B641: -16 | C641: 21 | D641: -5 | E641: of:=ABS([.B641])+ABS([.C641])+ABS([.D641]) -> 42
A642: 920 | B642: -17 | C642: -3 | D642: 22 | E642: of:=ABS([.B642])+ABS([.C642])+ABS([.D642]) -> 42
A643: 922 | B643: 6 | C643: 18 | D643: 18 | E643: of:=ABS([.B643])+ABS([.C643])+ABS([.D643]) -> 42
A644: 925 | B644: -1 | C644: -26 | D644: 15 | E644: of:=ABS([.B644])+ABS([.C644])+ABS([.D644]) -> 42
A645: 934 | B645: 6 | C645: -19 | D645: -17 | E645: of:=ABS([.B645])+ABS([.C645])+ABS([.D645]) -> 42
A646: 958 | B646: -10 | C646: -20 | D646: -12 | E646: of:=ABS([.B646])+ABS([.C646])+ABS([.D646]) -> 42
A647: 4 | B647: 19 | C647: -12 | D647: -12 | E647: of:=ABS([.B647])+ABS([.C647])+ABS([.D647]) -> 43
A648: 460 | B648: 25 | C648: -3 | D648: 15 | E648: of:=ABS([.B648])+ABS([.C648])+ABS([.D648]) -> 43
A649: 466 | B649: -10 | C649: 20 | D649: -13 | E649: of:=ABS([.B649])+ABS([.C649])+ABS([.D649]) -> 43
A650: 480 | B650: 26 | C650: -8 | D650: -9 | E650: of:=ABS([.B650])+ABS([.C650])+ABS([.D650]) -> 43
A651: 500 | B651: 39 | C651: 2 | D651: 2 | E651: of:=ABS([.B651])+ABS([.C651])+ABS([.D651]) -> 43
A652: 503 | B652: 7 | C652: -11 | D652: 25 | E652: of:=ABS([.B652])+ABS([.C652])+ABS([.D652]) -> 43
A653: 543 | B653: 13 | C653: 9 | D653: 21 | E653: of:=ABS([.B653])+ABS([.C653])+ABS([.D653]) -> 43
A654: 551 | B654: -11 | C654: -21 | D654: -11 | E654: of:=ABS([.B654])+ABS([.C654])+ABS([.D654]) -> 43
A655: 577 | B655: 12 | C655: -9 | D655: -22 | E655: of:=ABS([.B655])+ABS([.C655])+ABS([.D655]) -> 43
A656: 590 | B656: 18 | C656: 18 | D656: 7 | E656: of:=ABS([.B656])+ABS([.C656])+ABS([.D656]) -> 43
A657: 592 | B657: 4 | C657: 7 | D657: 32 | E657: of:=ABS([.B657])+ABS([.C657])+ABS([.D657]) -> 43
A658: 597 | B658: -3 | C658: 13 | D658: -27 | E658: of:=ABS([.B658])+ABS([.C658])+ABS([.D658]) -> 43
A659: 598 | B659: -23 | C659: 19 | D659: 1 | E659: of:=ABS([.B659])+ABS([.C659])+ABS([.D659]) -> 43
A660: 605 | B660: 6 | C660: -19 | D660: 18 | E660: of:=ABS([.B660])+ABS([.C660])+ABS([.D660]) -> 43
A661: 607 | B661: 10 | C661: 20 | D661: 13 | E661: of:=ABS([.B661])+ABS([.C661])+ABS([.D661]) -> 43
A662: 629 | B662: 11 | C662: 14 | D662: -18 | E662: of:=ABS([.B662])+ABS([.C662])+ABS([.D662]) -> 43
A663: 637 | B663: -9 | C663: 28 | D663: 6 | E663: of:=ABS([.B663])+ABS([.C663])+ABS([.D663]) -> 43
A664: 670 | B664: 10 | C664: 20 | D664: 13 | E664: of:=ABS([.B664])+ABS([.C664])+ABS([.D664]) -> 43
A665: 680 | B665: 18 | C665: 11 | D665: 14 | E665: of:=ABS([.B665])+ABS([.C665])+ABS([.D665]) -> 43
A666: 699 | B666: 22 | C666: -16 | D666: -5 | E666: of:=ABS([.B666])+ABS([.C666])+ABS([.D666]) -> 43
A667: 717 | B667: 4 | C667: -28 | D667: 11 | E667: of:=ABS([.B667])+ABS([.C667])+ABS([.D667]) -> 43
A668: 731 | B668: -8 | C668: -22 | D668: -13 | E668: of:=ABS([.B668])+ABS([.C668])+ABS([.D668]) -> 43
A669: 762 | B669: 16 | C669: -9 | D669: 18 | E669: of:=ABS([.B669])+ABS([.C669])+ABS([.D669]) -> 43
A670: 764 | B670: -32 | C670: -11 | D670: 0 | E670: of:=ABS([.B670])+ABS([.C670])+ABS([.D670]) -> 43
A671: 771 | B671: 29 | C671: 9 | D671: 5 | E671: of:=ABS([.B671])+ABS([.C671])+ABS([.D671]) -> 43
A672: 776 | B672: 31 | C672: 10 | D672: -2 | E672: of:=ABS([.B672])+ABS([.C672])+ABS([.D672]) -> 43
A673: 806 | B673: -12 | C673: 21 | D673: 10 | E673: of:=ABS([.B673])+ABS([.C673])+ABS([.D673]) -> 43
A674: 866 | B674: -13 | C674: 22 | D674: 8 | E674: of:=ABS([.B674])+ABS([.C674])+ABS([.D674]) -> 43
A675: 872 | B675: 33 | C675: 7 | D675: -3 | E675: of:=ABS([.B675])+ABS([.C675])+ABS([.D675]) -> 43
A676: 875 | B676: -27 | C676: 7 | D676: -9 | E676: of:=ABS([.B676])+ABS([.C676])+ABS([.D676]) -> 43
A677: 885 | B677: 3 | C677: -13 | D677: 27 | E677: of:=ABS([.B677])+ABS([.C677])+ABS([.D677]) -> 43
A678: 908 | B678: -8 | C678: 7 | D678: 28 | E678: of:=ABS([.B678])+ABS([.C678])+ABS([.D678]) -> 43
A679: 911 | B679: -8 | C679: 10 | D679: 25 | E679: of:=ABS([.B679])+ABS([.C679])+ABS([.D679]) -> 43
A680: 951 | B680: -16 | C680: -25 | D680: -2 | E680: of:=ABS([.B680])+ABS([.C680])+ABS([.D680]) -> 43
A681: 970 | B681: -26 | C681: -8 | D681: -9 | E681: of:=ABS([.B681])+ABS([.C681])+ABS([.D681]) -> 43
A682: 449 | B682: -27 | C682: -2 | D682: 15 | E682: of:=ABS([.B682])+ABS([.C682])+ABS([.D682]) -> 44
A683: 478 | B683: 13 | C683: 9 | D683: -22 | E683: of:=ABS([.B683])+ABS([.C683])+ABS([.D683]) -> 44
A684: 479 | B684: 8 | C684: -21 | D684: 15 | E684: of:=ABS([.B684])+ABS([.C684])+ABS([.D684]) -> 44
A685: 531 | B685: 23 | C685: 20 | D685: 1 | E685: of:=ABS([.B685])+ABS([.C685])+ABS([.D685]) -> 44
A686: 532 | B686: -5 | C686: 27 | D686: -12 | E686: of:=ABS([.B686])+ABS([.C686])+ABS([.D686]) -> 44
A687: 544 | B687: -1 | C687: -19 | D687: 24 | E687: of:=ABS([.B687])+ABS([.C687])+ABS([.D687]) -> 44
A688: 558 | B688: -7 | C688: 9 | D688: -28 | E688: of:=ABS([.B688])+ABS([.C688])+ABS([.D688]) -> 44
A689: 567 | B689: 8 | C689: 35 | D689: -1 | E689: of:=ABS([.B689])+ABS([.C689])+ABS([.D689]) -> 44
A690: 645 | B690: 6 | C690: -15 | D690: 23 | E690: of:=ABS([.B690])+ABS([.C690])+ABS([.D690]) -> 44
A691: 660 | B691: -22 | C691: 22 | D691: 0 | E691: of:=ABS([.B691])+ABS([.C691])+ABS([.D691]) -> 44
A692: 666 | B692: 23 | C692: -20 | D692: -1 | E692: of:=ABS([.B692])+ABS([.C692])+ABS([.D692]) -> 44
A693: 668 | B693: 7 | C693: -3 | D693: 34 | E693: of:=ABS([.B693])+ABS([.C693])+ABS([.D693]) -> 44
A694: 675 | B694: 8 | C694: -6 | D694: -30 | E694: of:=ABS([.B694])+ABS([.C694])+ABS([.D694]) -> 44
A695: 683 | B695: 19 | C695: -8 | D695: -17 | E695: of:=ABS([.B695])+ABS([.C695])+ABS([.D695]) -> 44
A696: 724 | B696: -3 | C696: 26 | D696: -15 | E696: of:=ABS([.B696])+ABS([.C696])+ABS([.D696]) -> 44
A697: 770 | B697: -2 | C697: -3 | D697: -39 | E697: of:=ABS([.B697])+ABS([.C697])+ABS([.D697]) -> 44
A698: 784 | B698: -10 | C698: -20 | D698: 14 | E698: of:=ABS([.B698])+ABS([.C698])+ABS([.D698]) -> 44
A699: 811 | B699: -20 | C699: -3 | D699: 21 | E699: of:=ABS([.B699])+ABS([.C699])+ABS([.D699]) -> 44
A700: 819 | B700: 11 | C700: -11 | D700: 22 | E700: of:=ABS([.B700])+ABS([.C700])+ABS([.D700]) -> 44
A701: 827 | B701: 4 | C701: 26 | D701: -14 | E701: of:=ABS([.B701])+ABS([.C701])+ABS([.D701]) -> 44
A702: 861 | B702: 14 | C702: 19 | D702: -11 | E702: of:=ABS([.B702])+ABS([.C702])+ABS([.D702]) -> 44
A703: 863 | B703: -25 | C703: -8 | D703: 11 | E703: of:=ABS([.B703])+ABS([.C703])+ABS([.D703]) -> 44
A704: 930 | B704: -29 | C704: 8 | D704: -7 | E704: of:=ABS([.B704])+ABS([.C704])+ABS([.D704]) -> 44
A705: 940 | B705: -21 | C705: 17 | D705: 6 | E705: of:=ABS([.B705])+ABS([.C705])+ABS([.D705]) -> 44
A706: 952 | B706: 5 | C706: -25 | D706: -14 | E706: of:=ABS([.B706])+ABS([.C706])+ABS([.D706]) -> 44
A707: 953 | B707: 31 | C707: 5 | D707: -8 | E707: of:=ABS([.B707])+ABS([.C707])+ABS([.D707]) -> 44
A708: 954 | B708: -22 | C708: -14 | D708: -8 | E708: of:=ABS([.B708])+ABS([.C708])+ABS([.D708]) -> 44
A709: 974 | B709: 12 | C709: -19 | D709: 13 | E709: of:=ABS([.B709])+ABS([.C709])+ABS([.D709]) -> 44
A710: 983 | B710: -17 | C710: 8 | D710: -19 | E710: of:=ABS([.B710])+ABS([.C710])+ABS([.D710]) -> 44
A711: 984 | B711: 6 | C711: -20 | D711: -18 | E711: of:=ABS([.B711])+ABS([.C711])+ABS([.D711]) -> 44
A712: 985 | B712: 28 | C712: 0 | D712: 16 | E712: of:=ABS([.B712])+ABS([.C712])+ABS([.D712]) -> 44
A713: 999 | B713: 23 | C713: -14 | D713: 7 | E713: of:=ABS([.B713])+ABS([.C713])+ABS([.D713]) -> 44
A714: 330 | B714: -17 | C714: -15 | D714: -13 | E714: of:=ABS([.B714])+ABS([.C714])+ABS([.D714]) -> 45
A715: 471 | B715: 32 | C715: 3 | D715: -10 | E715: of:=ABS([.B715])+ABS([.C715])+ABS([.D715]) -> 45
A716: 520 | B716: -6 | C716: -22 | D716: -17 | E716: of:=ABS([.B716])+ABS([.C716])+ABS([.D716]) -> 45
A717: 522 | B717: 8 | C717: 15 | D717: -22 | E717: of:=ABS([.B717])+ABS([.C717])+ABS([.D717]) -> 45
A718: 527 | B718: -6 | C718: -24 | D718: 15 | E718: of:=ABS([.B718])+ABS([.C718])+ABS([.D718]) -> 45
A719: 530 | B719: 6 | C719: -26 | D719: -13 | E719: of:=ABS([.B719])+ABS([.C719])+ABS([.D719]) -> 45
A720: 535 | B720: -13 | C720: -3 | D720: -29 | E720: of:=ABS([.B720])+ABS([.C720])+ABS([.D720]) -> 45
A721: 565 | B721: -3 | C721: 8 | D721: 34 | E721: of:=ABS([.B721])+ABS([.C721])+ABS([.D721]) -> 45
A722: 568 | B722: -8 | C722: -18 | D722: 19 | E722: of:=ABS([.B722])+ABS([.C722])+ABS([.D722]) -> 45
A723: 614 | B723: -10 | C723: 5 | D723: 30 | E723: of:=ABS([.B723])+ABS([.C723])+ABS([.D723]) -> 45
A724: 630 | B724: 9 | C724: 33 | D724: 3 | E724: of:=ABS([.B724])+ABS([.C724])+ABS([.D724]) -> 45
A725: 633 | B725: 20 | C725: 15 | D725: -10 | E725: of:=ABS([.B725])+ABS([.C725])+ABS([.D725]) -> 45
A726: 698 | B726: -3 | C726: 9 | D726: 33 | E726: of:=ABS([.B726])+ABS([.C726])+ABS([.D726]) -> 45
A727: 721 | B727: -11 | C727: -22 | D727: -12 | E727: of:=ABS([.B727])+ABS([.C727])+ABS([.D727]) -> 45
A728: 743 | B728: -10 | C728: 22 | D728: -13 | E728: of:=ABS([.B728])+ABS([.C728])+ABS([.D728]) -> 45
A729: 752 | B729: -30 | C729: -15 | D729: 0 | E729: of:=ABS([.B729])+ABS([.C729])+ABS([.D729]) -> 45
A730: 755 | B730: 5 | C730: -7 | D730: 33 | E730: of:=ABS([.B730])+ABS([.C730])+ABS([.D730]) -> 45
A731: 763 | B731: -14 | C731: 2 | D731: -29 | E731: of:=ABS([.B731])+ABS([.C731])+ABS([.D731]) -> 45
A732: 772 | B732: -14 | C732: -17 | D732: -14 | E732: of:=ABS([.B732])+ABS([.C732])+ABS([.D732]) -> 45
A733: 793 | B733: -22 | C733: -3 | D733: 20 | E733: of:=ABS([.B733])+ABS([.C733])+ABS([.D733]) -> 45
A734: 902 | B734: -3 | C734: -19 | D734: 23 | E734: of:=ABS([.B734])+ABS([.C734])+ABS([.D734]) -> 45
A735: 907 | B735: -31 | C735: -10 | D735: 4 | E735: of:=ABS([.B735])+ABS([.C735])+ABS([.D735]) -> 45
A736: 950 | B736: -22 | C736: -21 | D736: -2 | E736: of:=ABS([.B736])+ABS([.C736])+ABS([.D736]) -> 45
A737: 962 | B737: -19 | C737: 8 | D737: 18 | E737: of:=ABS([.B737])+ABS([.C737])+ABS([.D737]) -> 45
A738: 980 | B738: -25 | C738: -13 | D738: 7 | E738: of:=ABS([.B738])+ABS([.C738])+ABS([.D738]) -> 45
A739: 437 | B739: -21 | C739: 4 | D739: 21 | E739: of:=ABS([.B739])+ABS([.C739])+ABS([.D739]) -> 46
A740: 458 | B740: 12 | C740: 21 | D740: -13 | E740: of:=ABS([.B740])+ABS([.C740])+ABS([.D740]) -> 46
A741: 481 | B741: 19 | C741: 5 | D741: -22 | E741: of:=ABS([.B741])+ABS([.C741])+ABS([.D741]) -> 46
A742: 490 | B742: -14 | C742: 24 | D742: -8 | E742: of:=ABS([.B742])+ABS([.C742])+ABS([.D742]) -> 46
A743: 494 | B743: 21 | C743: 19 | D743: -6 | E743: of:=ABS([.B743])+ABS([.C743])+ABS([.D743]) -> 46
A744: 501 | B744: -2 | C744: 25 | D744: -19 | E744: of:=ABS([.B744])+ABS([.C744])+ABS([.D744]) -> 46
A745: 502 | B745: -21 | C745: 13 | D745: 12 | E745: of:=ABS([.B745])+ABS([.C745])+ABS([.D745]) -> 46
A746: 533 | B746: -16 | C746: -6 | D746: 24 | E746: of:=ABS([.B746])+ABS([.C746])+ABS([.D746]) -> 46
A747: 571 | B747: -14 | C747: 6 | D747: -26 | E747: of:=ABS([.B747])+ABS([.C747])+ABS([.D747]) -> 46
A748: 573 | B748: -4 | C748: 13 | D748: 29 | E748: of:=ABS([.B748])+ABS([.C748])+ABS([.D748]) -> 46
A749: 574 | B749: -7 | C749: 26 | D749: 13 | E749: of:=ABS([.B749])+ABS([.C749])+ABS([.D749]) -> 46
A750: 578 | B750: -10 | C750: -8 | D750: 28 | E750: of:=ABS([.B750])+ABS([.C750])+ABS([.D750]) -> 46
A751: 583 | B751: -17 | C751: 24 | D751: 5 | E751: of:=ABS([.B751])+ABS([.C751])+ABS([.D751]) -> 46
A752: 585 | B752: 11 | C752: 10 | D752: -25 | E752: of:=ABS([.B752])+ABS([.C752])+ABS([.D752]) -> 46
A753: 593 | B753: 15 | C753: -25 | D753: 6 | E753: of:=ABS([.B753])+ABS([.C753])+ABS([.D753]) -> 46
A754: 594 | B754: 1 | C754: 24 | D754: 21 | E754: of:=ABS([.B754])+ABS([.C754])+ABS([.D754]) -> 46
A755: 623 | B755: 19 | C755: -7 | D755: -20 | E755: of:=ABS([.B755])+ABS([.C755])+ABS([.D755]) -> 46
A756: 638 | B756: 13 | C756: -17 | D756: 16 | E756: of:=ABS([.B756])+ABS([.C756])+ABS([.D756]) -> 46
A757: 663 | B757: -6 | C757: 17 | D757: -23 | E757: of:=ABS([.B757])+ABS([.C757])+ABS([.D757]) -> 46
A758: 665 | B758: -20 | C758: 8 | D758: 18 | E758: of:=ABS([.B758])+ABS([.C758])+ABS([.D758]) -> 46
A759: 726 | B759: -34 | C759: 3 | D759: -9 | E759: of:=ABS([.B759])+ABS([.C759])+ABS([.D759]) -> 46
A760: 759 | B760: 30 | C760: -14 | D760: 2 | E760: of:=ABS([.B760])+ABS([.C760])+ABS([.D760]) -> 46
A761: 774 | B761: 21 | C761: 17 | D761: 8 | E761: of:=ABS([.B761])+ABS([.C761])+ABS([.D761]) -> 46
A762: 783 | B762: 25 | C762: -7 | D762: -14 | E762: of:=ABS([.B762])+ABS([.C762])+ABS([.D762]) -> 46
A763: 786 | B763: 15 | C763: -3 | D763: 28 | E763: of:=ABS([.B763])+ABS([.C763])+ABS([.D763]) -> 46
A764: 808 | B764: 8 | C764: 3 | D764: -35 | E764: of:=ABS([.B764])+ABS([.C764])+ABS([.D764]) -> 46
A765: 834 | B765: -32 | C765: 10 | D765: 4 | E765: of:=ABS([.B765])+ABS([.C765])+ABS([.D765]) -> 46
A766: 886 | B766: 1 | C766: 14 | D766: 31 | E766: of:=ABS([.B766])+ABS([.C766])+ABS([.D766]) -> 46
A767: 895 | B767: -21 | C767: 1 | D767: -24 | E767: of:=ABS([.B767])+ABS([.C767])+ABS([.D767]) -> 46
A768: 910 | B768: -1 | C768: -18 | D768: -27 | E768: of:=ABS([.B768])+ABS([.C768])+ABS([.D768]) -> 46
A769: 912 | B769: -5 | C769: -24 | D769: -17 | E769: of:=ABS([.B769])+ABS([.C769])+ABS([.D769]) -> 46
A770: 913 | B770: 28 | C770: 12 | D770: -6 | E770: of:=ABS([.B770])+ABS([.C770])+ABS([.D770]) -> 46
A771: 915 | B771: -25 | C771: 18 | D771: 3 | E771: of:=ABS([.B771])+ABS([.C771])+ABS([.D771]) -> 46
A772: 921 | B772: 24 | C772: -11 | D772: 11 | E772: of:=ABS([.B772])+ABS([.C772])+ABS([.D772]) -> 46
A773: 942 | B773: 10 | C773: -21 | D773: 15 | E773: of:=ABS([.B773])+ABS([.C773])+ABS([.D773]) -> 46
A774: 949 | B774: -19 | C774: 18 | D774: -9 | E774: of:=ABS([.B774])+ABS([.C774])+ABS([.D774]) -> 46
A775: 439 | B775: 8 | C775: -6 | D775: -33 | E775: of:=ABS([.B775])+ABS([.C775])+ABS([.D775]) -> 47
A776: 456 | B776: -27 | C776: 0 | D776: 20 | E776: of:=ABS([.B776])+ABS([.C776])+ABS([.D776]) -> 47
A777: 483 | B777: -11 | C777: -24 | D777: 12 | E777: of:=ABS([.B777])+ABS([.C777])+ABS([.D777]) -> 47
A778: 488 | B778: -33 | C778: 5 | D778: 9 | E778: of:=ABS([.B778])+ABS([.C778])+ABS([.D778]) -> 47
A779: 492 | B779: 24 | C779: 15 | D779: -8 | E779: of:=ABS([.B779])+ABS([.C779])+ABS([.D779]) -> 47
A780: 497 | B780: -29 | C780: 11 | D780: -7 | E780: of:=ABS([.B780])+ABS([.C780])+ABS([.D780]) -> 47
A781: 499 | B781: -5 | C781: 24 | D781: -18 | E781: of:=ABS([.B781])+ABS([.C781])+ABS([.D781]) -> 47
A782: 552 | B782: -13 | C782: 26 | D782: -8 | E782: of:=ABS([.B782])+ABS([.C782])+ABS([.D782]) -> 47
A783: 556 | B783: -3 | C783: 23 | D783: 21 | E783: of:=ABS([.B783])+ABS([.C783])+ABS([.D783]) -> 47
A784: 600 | B784: 9 | C784: -19 | D784: -19 | E784: of:=ABS([.B784])+ABS([.C784])+ABS([.D784]) -> 47
A785: 612 | B785: -26 | C785: -17 | D785: -4 | E785: of:=ABS([.B785])+ABS([.C785])+ABS([.D785]) -> 47
A786: 635 | B786: -20 | C786: 18 | D786: 9 | E786: of:=ABS([.B786])+ABS([.C786])+ABS([.D786]) -> 47
A787: 648 | B787: -25 | C787: 22 | D787: 0 | E787: of:=ABS([.B787])+ABS([.C787])+ABS([.D787]) -> 47
A788: 676 | B788: 28 | C788: -11 | D788: 8 | E788: of:=ABS([.B788])+ABS([.C788])+ABS([.D788]) -> 47
A789: 700 | B789: -3 | C789: 13 | D789: 31 | E789: of:=ABS([.B789])+ABS([.C789])+ABS([.D789]) -> 47
A790: 716 | B790: 4 | C790: 23 | D790: 20 | E790: of:=ABS([.B790])+ABS([.C790])+ABS([.D790]) -> 47
A791: 733 | B791: 8 | C791: -24 | D791: 15 | E791: of:=ABS([.B791])+ABS([.C791])+ABS([.D791]) -> 47
A792: 794 | B792: 8 | C792: 20 | D792: -19 | E792: of:=ABS([.B792])+ABS([.C792])+ABS([.D792]) -> 47
A793: 801 | B793: 10 | C793: -11 | D793: -26 | E793: of:=ABS([.B793])+ABS([.C793])+ABS([.D793]) -> 47
A794: 832 | B794: 12 | C794: 24 | D794: -11 | E794: of:=ABS([.B794])+ABS([.C794])+ABS([.D794]) -> 47
A795: 844 | B795: -19 | C795: -4 | D795: 24 | E795: of:=ABS([.B795])+ABS([.C795])+ABS([.D795]) -> 47
A796: 847 | B796: -22 | C796: -17 | D796: 8 | E796: of:=ABS([.B796])+ABS([.C796])+ABS([.D796]) -> 47
A797: 857 | B797: -14 | C797: 19 | D797: 14 | E797: of:=ABS([.B797])+ABS([.C797])+ABS([.D797]) -> 47
A798: 903 | B798: 6 | C798: 17 | D798: 24 | E798: of:=ABS([.B798])+ABS([.C798])+ABS([.D798]) -> 47
A799: 944 | B799: -16 | C799: 7 | D799: 24 | E799: of:=ABS([.B799])+ABS([.C799])+ABS([.D799]) -> 47
A800: 993 | B800: -28 | C800: -1 | D800: -18 | E800: of:=ABS([.B800])+ABS([.C800])+ABS([.D800]) -> 47
A801: 429 | B801: -28 | C801: 14 | D801: -6 | E801: of:=ABS([.B801])+ABS([.C801])+ABS([.D801]) -> 48
A802: 431 | B802: 25 | C802: -20 | D802: -3 | E802: of:=ABS([.B802])+ABS([.C802])+ABS([.D802]) -> 48
A803: 438 | B803: 15 | C803: -21 | D803: -12 | E803: of:=ABS([.B803])+ABS([.C803])+ABS([.D803]) -> 48
A804: 448 | B804: -20 | C804: -12 | D804: -16 | E804: of:=ABS([.B804])+ABS([.C804])+ABS([.D804]) -> 48
A805: 489 | B805: 13 | C805: 15 | D805: -20 | E805: of:=ABS([.B805])+ABS([.C805])+ABS([.D805]) -> 48
A806: 495 | B806: -2 | C806: 25 | D806: -21 | E806: of:=ABS([.B806])+ABS([.C806])+ABS([.D806]) -> 48
A807: 504 | B807: -20 | C807: -6 | D807: -22 | E807: of:=ABS([.B807])+ABS([.C807])+ABS([.D807]) -> 48
A808: 509 | B808: 14 | C808: -19 | D808: -15 | E808: of:=ABS([.B808])+ABS([.C808])+ABS([.D808]) -> 48
A809: 513 | B809: 26 | C809: 7 | D809: -15 | E809: of:=ABS([.B809])+ABS([.C809])+ABS([.D809]) -> 48
A810: 523 | B810: -6 | C810: -24 | D810: -18 | E810: of:=ABS([.B810])+ABS([.C810])+ABS([.D810]) -> 48
A811: 529 | B811: -26 | C811: -22 | D811: 0 | E811: of:=ABS([.B811])+ABS([.C811])+ABS([.D811]) -> 48
A812: 596 | B812: -5 | C812: 25 | D812: 18 | E812: of:=ABS([.B812])+ABS([.C812])+ABS([.D812]) -> 48
A813: 601 | B813: 14 | C813: -16 | D813: -18 | E813: of:=ABS([.B813])+ABS([.C813])+ABS([.D813]) -> 48
A814: 643 | B814: -3 | C814: 24 | D814: -21 | E814: of:=ABS([.B814])+ABS([.C814])+ABS([.D814]) -> 48
A815: 677 | B815: -5 | C815: 23 | D815: 20 | E815: of:=ABS([.B815])+ABS([.C815])+ABS([.D815]) -> 48
A816: 685 | B816: 13 | C816: -24 | D816: -11 | E816: of:=ABS([.B816])+ABS([.C816])+ABS([.D816]) -> 48
A817: 686 | B817: 25 | C817: -16 | D817: 7 | E817: of:=ABS([.B817])+ABS([.C817])+ABS([.D817]) -> 48
A818: 691 | B818: -15 | C818: 27 | D818: -6 | E818: of:=ABS([.B818])+ABS([.C818])+ABS([.D818]) -> 48
A819: 702 | B819: 27 | C819: 9 | D819: 12 | E819: of:=ABS([.B819])+ABS([.C819])+ABS([.D819]) -> 48
A820: 704 | B820: 9 | C820: 27 | D820: 12 | E820: of:=ABS([.B820])+ABS([.C820])+ABS([.D820]) -> 48
A821: 782 | B821: -11 | C821: -32 | D821: -5 | E821: of:=ABS([.B821])+ABS([.C821])+ABS([.D821]) -> 48
A822: 798 | B822: -21 | C822: -15 | D822: 12 | E822: of:=ABS([.B822])+ABS([.C822])+ABS([.D822]) -> 48
A823: 826 | B823: -21 | C823: -17 | D823: -10 | E823: of:=ABS([.B823])+ABS([.C823])+ABS([.D823]) -> 48
A824: 831 | B824: 30 | C824: -16 | D824: -2 | E824: of:=ABS([.B824])+ABS([.C824])+ABS([.D824]) -> 48
A825: 869 | B825: 29 | C825: -8 | D825: -11 | E825: of:=ABS([.B825])+ABS([.C825])+ABS([.D825]) -> 48
A826: 919 | B826: 11 | C826: -29 | D826: -8 | E826: of:=ABS([.B826])+ABS([.C826])+ABS([.D826]) -> 48
A827: 969 | B827: -22 | C827: -4 | D827: -22 | E827: of:=ABS([.B827])+ABS([.C827])+ABS([.D827]) -> 48
A828: 975 | B828: 10 | C828: -16 | D828: 22 | E828: of:=ABS([.B828])+ABS([.C828])+ABS([.D828]) -> 48
A829: 430 | B829: 17 | C829: -16 | D829: -16 | E829: of:=ABS([.B829])+ABS([.C829])+ABS([.D829]) -> 49
A830: 473 | B830: -2 | C830: -28 | D830: 19 | E830: of:=ABS([.B830])+ABS([.C830])+ABS([.D830]) -> 49
A831: 510 | B831: 12 | C831: -8 | D831: -29 | E831: of:=ABS([.B831])+ABS([.C831])+ABS([.D831]) -> 49
A832: 514 | B832: -21 | C832: -12 | D832: -16 | E832: of:=ABS([.B832])+ABS([.C832])+ABS([.D832]) -> 49
A833: 540 | B833: -25 | C833: -17 | D833: -7 | E833: of:=ABS([.B833])+ABS([.C833])+ABS([.D833]) -> 49
A834: 569 | B834: 15 | C834: -13 | D834: -21 | E834: of:=ABS([.B834])+ABS([.C834])+ABS([.D834]) -> 49
A835: 586 | B835: -16 | C835: -14 | D835: -19 | E835: of:=ABS([.B835])+ABS([.C835])+ABS([.D835]) -> 49
A836: 599 | B836: 16 | C836: -15 | D836: 18 | E836: of:=ABS([.B836])+ABS([.C836])+ABS([.D836]) -> 49
A837: 617 | B837: -33 | C837: 7 | D837: -9 | E837: of:=ABS([.B837])+ABS([.C837])+ABS([.D837]) -> 49
A838: 618 | B838: -3 | C838: 34 | D838: -12 | E838: of:=ABS([.B838])+ABS([.C838])+ABS([.D838]) -> 49
A839: 634 | B839: 23 | C839: 20 | D839: -6 | E839: of:=ABS([.B839])+ABS([.C839])+ABS([.D839]) -> 49
A840: 672 | B840: -15 | C840: 11 | D840: -23 | E840: of:=ABS([.B840])+ABS([.C840])+ABS([.D840]) -> 49
A841: 684 | B841: -19 | C841: 16 | D841: -14 | E841: of:=ABS([.B841])+ABS([.C841])+ABS([.D841]) -> 49
A842: 727 | B842: -28 | C842: 1 | D842: -20 | E842: of:=ABS([.B842])+ABS([.C842])+ABS([.D842]) -> 49
A843: 754 | B843: -13 | C843: -15 | D843: -21 | E843: of:=ABS([.B843])+ABS([.C843])+ABS([.D843]) -> 49
A844: 766 | B844: -29 | C844: -7 | D844: -13 | E844: of:=ABS([.B844])+ABS([.C844])+ABS([.D844]) -> 49
A845: 767 | B845: -17 | C845: -8 | D845: -24 | E845: of:=ABS([.B845])+ABS([.C845])+ABS([.D845]) -> 49
A846: 791 | B846: -19 | C846: -29 | D846: 1 | E846: of:=ABS([.B846])+ABS([.C846])+ABS([.D846]) -> 49
A847: 825 | B847: 4 | C847: -21 | D847: 24 | E847: of:=ABS([.B847])+ABS([.C847])+ABS([.D847]) -> 49
A848: 849 | B848: -23 | C848: 4 | D848: -22 | E848: of:=ABS([.B848])+ABS([.C848])+ABS([.D848]) -> 49
A849: 858 | B849: -22 | C849: -12 | D849: 15 | E849: of:=ABS([.B849])+ABS([.C849])+ABS([.D849]) -> 49
A850: 897 | B850: -13 | C850: 29 | D850: 7 | E850: of:=ABS([.B850])+ABS([.C850])+ABS([.D850]) -> 49
A851: 904 | B851: 7 | C851: 31 | D851: 11 | E851: of:=ABS([.B851])+ABS([.C851])+ABS([.D851]) -> 49
A852: 955 | B852: -37 | C852: -3 | D852: 9 | E852: of:=ABS([.B852])+ABS([.C852])+ABS([.D852]) -> 49
A853: 959 | B853: 26 | C853: -18 | D853: 5 | E853: of:=ABS([.B853])+ABS([.C853])+ABS([.D853]) -> 49
A854: 964 | B854: 34 | C854: 11 | D854: 4 | E854: of:=ABS([.B854])+ABS([.C854])+ABS([.D854]) -> 49
A855: 977 | B855: -32 | C855: -12 | D855: 5 | E855: of:=ABS([.B855])+ABS([.C855])+ABS([.D855]) -> 49
A856: 986 | B856: 8 | C856: -23 | D856: 18 | E856: of:=ABS([.B856])+ABS([.C856])+ABS([.D856]) -> 49
A857: 445 | B857: -10 | C857: -8 | D857: 32 | E857: of:=ABS([.B857])+ABS([.C857])+ABS([.D857]) -> 50
A858: 485 | B858: -4 | C858: -17 | D858: -29 | E858: of:=ABS([.B858])+ABS([.C858])+ABS([.D858]) -> 50
A859: 487 | B859: -9 | C859: 23 | D859: -18 | E859: of:=ABS([.B859])+ABS([.C859])+ABS([.D859]) -> 50
A860: 496 | B860: 2 | C860: 31 | D860: -17 | E860: of:=ABS([.B860])+ABS([.C860])+ABS([.D860]) -> 50
A861: 526 | B861: 22 | C861: 10 | D861: 18 | E861: of:=ABS([.B861])+ABS([.C861])+ABS([.D861]) -> 50
A862: 559 | B862: 23 | C862: 4 | D862: 23 | E862: of:=ABS([.B862])+ABS([.C862])+ABS([.D862]) -> 50
A863: 560 | B863: 28 | C863: 5 | D863: -17 | E863: of:=ABS([.B863])+ABS([.C863])+ABS([.D863]) -> 50
A864: 581 | B864: -7 | C864: -34 | D864: -9 | E864: of:=ABS([.B864])+ABS([.C864])+ABS([.D864]) -> 50
A865: 582 | B865: -21 | C865: -15 | D865: -14 | E865: of:=ABS([.B865])+ABS([.C865])+ABS([.D865]) -> 50
A866: 609 | B866: -18 | C866: -22 | D866: 10 | E866: of:=ABS([.B866])+ABS([.C866])+ABS([.D866]) -> 50
A867: 615 | B867: -8 | C867: 15 | D867: 27 | E867: of:=ABS([.B867])+ABS([.C867])+ABS([.D867]) -> 50
A868: 639 | B868: 21 | C868: -26 | D868: -3 | E868: of:=ABS([.B868])+ABS([.C868])+ABS([.D868]) -> 50
A869: 674 | B869: -19 | C869: -29 | D869: -2 | E869: of:=ABS([.B869])+ABS([.C869])+ABS([.D869]) -> 50
A870: 719 | B870: 13 | C870: -7 | D870: -30 | E870: of:=ABS([.B870])+ABS([.C870])+ABS([.D870]) -> 50
A871: 734 | B871: 31 | C871: 9 | D871: 10 | E871: of:=ABS([.B871])+ABS([.C871])+ABS([.D871]) -> 50
A872: 741 | B872: -29 | C872: -8 | D872: -13 | E872: of:=ABS([.B872])+ABS([.C872])+ABS([.D872]) -> 50
A873: 742 | B873: 18 | C873: -10 | D873: 22 | E873: of:=ABS([.B873])+ABS([.C873])+ABS([.D873]) -> 50
A874: 795 | B874: -16 | C874: -9 | D874: -25 | E874: of:=ABS([.B874])+ABS([.C874])+ABS([.D874]) -> 50
A875: 797 | B875: -22 | C875: 25 | D875: -3 | E875: of:=ABS([.B875])+ABS([.C875])+ABS([.D875]) -> 50
A876: 807 | B876: 27 | C876: -2 | D876: -21 | E876: of:=ABS([.B876])+ABS([.C876])+ABS([.D876]) -> 50
A877: 828 | B877: 5 | C877: 23 | D877: 22 | E877: of:=ABS([.B877])+ABS([.C877])+ABS([.D877]) -> 50
A878: 830 | B878: 13 | C878: 18 | D878: -19 | E878: of:=ABS([.B878])+ABS([.C878])+ABS([.D878]) -> 50
A879: 836 | B879: 2 | C879: -32 | D879: 16 | E879: of:=ABS([.B879])+ABS([.C879])+ABS([.D879]) -> 50
A880: 878 | B880: 26 | C880: -13 | D880: -11 | E880: of:=ABS([.B880])+ABS([.C880])+ABS([.D880]) -> 50
A881: 917 | B881: 15 | C881: -22 | D881: 13 | E881: of:=ABS([.B881])+ABS([.C881])+ABS([.D881]) -> 50
A882: 941 | B882: 25 | C882: -20 | D882: -5 | E882: of:=ABS([.B882])+ABS([.C882])+ABS([.D882]) -> 50
A883: 960 | B883: -20 | C883: -23 | D883: 7 | E883: of:=ABS([.B883])+ABS([.C883])+ABS([.D883]) -> 50
A884: 450 | B884: -21 | C884: 13 | D884: 17 | E884: of:=ABS([.B884])+ABS([.C884])+ABS([.D884]) -> 51
A885: 484 | B885: 7 | C885: -21 | D885: 23 | E885: of:=ABS([.B885])+ABS([.C885])+ABS([.D885]) -> 51
A886: 506 | B886: 31 | C886: -9 | D886: 11 | E886: of:=ABS([.B886])+ABS([.C886])+ABS([.D886]) -> 51
A887: 587 | B887: -26 | C887: 14 | D887: -11 | E887: of:=ABS([.B887])+ABS([.C887])+ABS([.D887]) -> 51
A888: 659 | B888: -9 | C888: -19 | D888: -23 | E888: of:=ABS([.B888])+ABS([.C888])+ABS([.D888]) -> 51
A889: 746 | B889: -12 | C889: 22 | D889: 17 | E889: of:=ABS([.B889])+ABS([.C889])+ABS([.D889]) -> 51
A890: 867 | B890: -9 | C890: 20 | D890: 22 | E890: of:=ABS([.B890])+ABS([.C890])+ABS([.D890]) -> 51
A891: 871 | B891: -18 | C891: 21 | D891: 12 | E891: of:=ABS([.B891])+ABS([.C891])+ABS([.D891]) -> 51
A892: 888 | B892: 9 | C892: 31 | D892: -11 | E892: of:=ABS([.B892])+ABS([.C892])+ABS([.D892]) -> 51
A893: 972 | B893: 9 | C893: -23 | D893: -19 | E893: of:=ABS([.B893])+ABS([.C893])+ABS([.D893]) -> 51
A894: 482 | B894: -9 | C894: -18 | D894: 25 | E894: of:=ABS([.B894])+ABS([.C894])+ABS([.D894]) -> 52
A895: 515 | B895: 14 | C895: -13 | D895: -25 | E895: of:=ABS([.B895])+ABS([.C895])+ABS([.D895]) -> 52
A896: 589 | B896: -23 | C896: 9 | D896: 20 | E896: of:=ABS([.B896])+ABS([.C896])+ABS([.D896]) -> 52
A897: 610 | B897: 8 | C897: 21 | D897: -23 | E897: of:=ABS([.B897])+ABS([.C897])+ABS([.D897]) -> 52
A898: 655 | B898: -18 | C898: -14 | D898: 20 | E898: of:=ABS([.B898])+ABS([.C898])+ABS([.D898]) -> 52
A899: 692 | B899: 23 | C899: 13 | D899: 16 | E899: of:=ABS([.B899])+ABS([.C899])+ABS([.D899]) -> 52
A900: 696 | B900: 17 | C900: 29 | D900: 6 | E900: of:=ABS([.B900])+ABS([.C900])+ABS([.D900]) -> 52
A901: 712 | B901: 4 | C901: 21 | D901: -27 | E901: of:=ABS([.B901])+ABS([.C901])+ABS([.D901]) -> 52
A902: 765 | B902: -15 | C902: 11 | D902: 26 | E902: of:=ABS([.B902])+ABS([.C902])+ABS([.D902]) -> 52
A903: 773 | B903: 16 | C903: 30 | D903: 6 | E903: of:=ABS([.B903])+ABS([.C903])+ABS([.D903]) -> 52
A904: 788 | B904: 11 | C904: 15 | D904: -26 | E904: of:=ABS([.B904])+ABS([.C904])+ABS([.D904]) -> 52
A905: 800 | B905: 3 | C905: 30 | D905: -19 | E905: of:=ABS([.B905])+ABS([.C905])+ABS([.D905]) -> 52
A906: 802 | B906: 12 | C906: 15 | D906: -25 | E906: of:=ABS([.B906])+ABS([.C906])+ABS([.D906]) -> 52
A907: 876 | B907: -16 | C907: 32 | D907: 4 | E907: of:=ABS([.B907])+ABS([.C907])+ABS([.D907]) -> 52
A908: 892 | B908: -36 | C908: 14 | D908: 2 | E908: of:=ABS([.B908])+ABS([.C908])+ABS([.D908]) -> 52
A909: 968 | B909: 10 | C909: 20 | D909: -22 | E909: of:=ABS([.B909])+ABS([.C909])+ABS([.D909]) -> 52
A910: 457 | B910: -23 | C910: -16 | D910: 14 | E910: of:=ABS([.B910])+ABS([.C910])+ABS([.D910]) -> 53
A911: 472 | B911: -21 | C911: -13 | D911: 19 | E911: of:=ABS([.B911])+ABS([.C911])+ABS([.D911]) -> 53
A912: 512 | B912: 18 | C912: 23 | D912: -12 | E912: of:=ABS([.B912])+ABS([.C912])+ABS([.D912]) -> 53
A913: 525 | B913: -6 | C913: 26 | D913: -21 | E913: of:=ABS([.B913])+ABS([.C913])+ABS([.D913]) -> 53
A914: 562 | B914: -18 | C914: 29 | D914: -6 | E914: of:=ABS([.B914])+ABS([.C914])+ABS([.D914]) -> 53
A915: 619 | B915: 13 | C915: -18 | D915: -22 | E915: of:=ABS([.B915])+ABS([.C915])+ABS([.D915]) -> 53
A916: 622 | B916: 12 | C916: 11 | D916: 30 | E916: of:=ABS([.B916])+ABS([.C916])+ABS([.D916]) -> 53
A917: 624 | B917: 18 | C917: 7 | D917: 28 | E917: of:=ABS([.B917])+ABS([.C917])+ABS([.D917]) -> 53
A918: 627 | B918: 13 | C918: 5 | D918: 35 | E918: of:=ABS([.B918])+ABS([.C918])+ABS([.D918]) -> 53
A919: 644 | B919: 20 | C919: -14 | D919: -19 | E919: of:=ABS([.B919])+ABS([.C919])+ABS([.D919]) -> 53
A920: 667 | B920: 25 | C920: -20 | D920: 8 | E920: of:=ABS([.B920])+ABS([.C920])+ABS([.D920]) -> 53
A921: 681 | B921: -21 | C921: -7 | D921: 25 | E921: of:=ABS([.B921])+ABS([.C921])+ABS([.D921]) -> 53
A922: 690 | B922: -22 | C922: 6 | D922: -25 | E922: of:=ABS([.B922])+ABS([.C922])+ABS([.D922]) -> 53
A923: 697 | B923: -13 | C923: -31 | D923: -9 | E923: of:=ABS([.B923])+ABS([.C923])+ABS([.D923]) -> 53
A924: 735 | B924: -30 | C924: 19 | D924: -4 | E924: of:=ABS([.B924])+ABS([.C924])+ABS([.D924]) -> 53
A925: 841 | B925: 17 | C925: 17 | D925: -19 | E925: of:=ABS([.B925])+ABS([.C925])+ABS([.D925]) -> 53
A926: 883 | B926: -19 | C926: 23 | D926: -11 | E926: of:=ABS([.B926])+ABS([.C926])+ABS([.D926]) -> 53
A927: 894 | B927: 9 | C927: -8 | D927: 36 | E927: of:=ABS([.B927])+ABS([.C927])+ABS([.D927]) -> 53
A928: 901 | B928: 20 | C928: 20 | D928: 13 | E928: of:=ABS([.B928])+ABS([.C928])+ABS([.D928]) -> 53
A929: 979 | B929: 1 | C929: 19 | D929: 33 | E929: of:=ABS([.B929])+ABS([.C929])+ABS([.D929]) -> 53
A930: 981 | B930: -13 | C930: 17 | D930: 23 | E930: of:=ABS([.B930])+ABS([.C930])+ABS([.D930]) -> 53
A931: 435 | B931: -23 | C931: -7 | D931: 24 | E931: of:=ABS([.B931])+ABS([.C931])+ABS([.D931]) -> 54
A932: 446 | B932: -17 | C932: 22 | D932: -15 | E932: of:=ABS([.B932])+ABS([.C932])+ABS([.D932]) -> 54
A933: 447 | B933: 11 | C933: -7 | D933: -36 | E933: of:=ABS([.B933])+ABS([.C933])+ABS([.D933]) -> 54
A934: 475 | B934: 13 | C934: -17 | D934: 24 | E934: of:=ABS([.B934])+ABS([.C934])+ABS([.D934]) -> 54
A935: 505 | B935: -21 | C935: -19 | D935: -14 | E935: of:=ABS([.B935])+ABS([.C935])+ABS([.D935]) -> 54
A936: 516 | B936: -10 | C936: 18 | D936: -26 | E936: of:=ABS([.B936])+ABS([.C936])+ABS([.D936]) -> 54
A937: 584 | B937: 31 | C937: -14 | D937: -9 | E937: of:=ABS([.B937])+ABS([.C937])+ABS([.D937]) -> 54
A938: 722 | B938: -9 | C938: 29 | D938: 16 | E938: of:=ABS([.B938])+ABS([.C938])+ABS([.D938]) -> 54
A939: 756 | B939: -24 | C939: 11 | D939: -19 | E939: of:=ABS([.B939])+ABS([.C939])+ABS([.D939]) -> 54
A940: 820 | B940: 15 | C940: -5 | D940: 34 | E940: of:=ABS([.B940])+ABS([.C940])+ABS([.D940]) -> 54
A941: 839 | B941: 24 | C941: -8 | D941: 22 | E941: of:=ABS([.B941])+ABS([.C941])+ABS([.D941]) -> 54
A942: 850 | B942: 12 | C942: -27 | D942: 15 | E942: of:=ABS([.B942])+ABS([.C942])+ABS([.D942]) -> 54
A943: 936 | B943: -20 | C943: -16 | D943: -18 | E943: of:=ABS([.B943])+ABS([.C943])+ABS([.D943]) -> 54
A944: 945 | B944: -19 | C944: 11 | D944: -24 | E944: of:=ABS([.B944])+ABS([.C944])+ABS([.D944]) -> 54
A945: 998 | B945: -12 | C945: -12 | D945: 30 | E945: of:=ABS([.B945])+ABS([.C945])+ABS([.D945]) -> 54
A946: 433 | B946: -11 | C946: 14 | D946: 30 | E946: of:=ABS([.B946])+ABS([.C946])+ABS([.D946]) -> 55
A947: 444 | B947: -24 | C947: 27 | D947: -4 | E947: of:=ABS([.B947])+ABS([.C947])+ABS([.D947]) -> 55
A948: 518 | B948: 15 | C948: 25 | D948: -15 | E948: of:=ABS([.B948])+ABS([.C948])+ABS([.D948]) -> 55
A949: 542 | B949: -14 | C949: -23 | D949: 18 | E949: of:=ABS([.B949])+ABS([.C949])+ABS([.D949]) -> 55
A950: 620 | B950: -18 | C950: 17 | D950: 20 | E950: of:=ABS([.B950])+ABS([.C950])+ABS([.D950]) -> 55
A951: 740 | B951: -20 | C951: -17 | D951: 18 | E951: of:=ABS([.B951])+ABS([.C951])+ABS([.D951]) -> 55
A952: 751 | B952: 14 | C952: 15 | D952: 26 | E952: of:=ABS([.B952])+ABS([.C952])+ABS([.D952]) -> 55
A953: 753 | B953: 36 | C953: 6 | D953: -13 | E953: of:=ABS([.B953])+ABS([.C953])+ABS([.D953]) -> 55
A954: 769 | B954: -25 | C954: 22 | D954: 8 | E954: of:=ABS([.B954])+ABS([.C954])+ABS([.D954]) -> 55
A955: 846 | B955: 25 | C955: 18 | D955: 12 | E955: of:=ABS([.B955])+ABS([.C955])+ABS([.D955]) -> 55
A956: 924 | B956: -22 | C956: 18 | D956: -15 | E956: of:=ABS([.B956])+ABS([.C956])+ABS([.D956]) -> 55
A957: 931 | B957: 12 | C957: -17 | D957: 26 | E957: of:=ABS([.B957])+ABS([.C957])+ABS([.D957]) -> 55
A958: 957 | B958: 22 | C958: 18 | D958: -15 | E958: of:=ABS([.B958])+ABS([.C958])+ABS([.D958]) -> 55
A959: 463 | B959: -27 | C959: -10 | D959: -19 | E959: of:=ABS([.B959])+ABS([.C959])+ABS([.D959]) -> 56
A960: 511 | B960: 34 | C960: 8 | D960: -14 | E960: of:=ABS([.B960])+ABS([.C960])+ABS([.D960]) -> 56
A961: 550 | B961: 25 | C961: -11 | D961: 20 | E961: of:=ABS([.B961])+ABS([.C961])+ABS([.D961]) -> 56
A962: 588 | B962: 17 | C962: -21 | D962: 18 | E962: of:=ABS([.B962])+ABS([.C962])+ABS([.D962]) -> 56
A963: 669 | B963: 17 | C963: 20 | D963: 19 | E963: of:=ABS([.B963])+ABS([.C963])+ABS([.D963]) -> 56
A964: 707 | B964: -18 | C964: -16 | D964: 22 | E964: of:=ABS([.B964])+ABS([.C964])+ABS([.D964]) -> 56
A965: 780 | B965: -11 | C965: 28 | D965: -17 | E965: of:=ABS([.B965])+ABS([.C965])+ABS([.D965]) -> 56
A966: 796 | B966: 26 | C966: -9 | D966: 21 | E966: of:=ABS([.B966])+ABS([.C966])+ABS([.D966]) -> 56
A967: 997 | B967: 10 | C967: 20 | D967: 26 | E967: of:=ABS([.B967])+ABS([.C967])+ABS([.D967]) -> 56
A968: 536 | B968: 26 | C968: -25 | D968: -6 | E968: of:=ABS([.B968])+ABS([.C968])+ABS([.D968]) -> 57
A969: 787 | B969: 19 | C969: -22 | D969: 16 | E969: of:=ABS([.B969])+ABS([.C969])+ABS([.D969]) -> 57
A970: 852 | B970: 30 | C970: 17 | D970: 10 | E970: of:=ABS([.B970])+ABS([.C970])+ABS([.D970]) -> 57
A971: 854 | B971: -28 | C971: -12 | D971: -17 | E971: of:=ABS([.B971])+ABS([.C971])+ABS([.D971]) -> 57
A972: 932 | B972: 9 | C972: -29 | D972: 19 | E972: of:=ABS([.B972])+ABS([.C972])+ABS([.D972]) -> 57
A973: 933 | B973: 18 | C973: 15 | D973: 24 | E973: of:=ABS([.B973])+ABS([.C973])+ABS([.D973]) -> 57
A974: 946 | B974: 29 | C974: -12 | D974: 16 | E974: of:=ABS([.B974])+ABS([.C974])+ABS([.D974]) -> 57
A975: 467 | B975: 10 | C975: 18 | D975: 30 | E975: of:=ABS([.B975])+ABS([.C975])+ABS([.D975]) -> 58
A976: 547 | B976: 6 | C976: -24 | D976: 28 | E976: of:=ABS([.B976])+ABS([.C976])+ABS([.D976]) -> 58
A977: 561 | B977: -23 | C977: 14 | D977: 21 | E977: of:=ABS([.B977])+ABS([.C977])+ABS([.D977]) -> 58
A978: 662 | B978: -33 | C978: 12 | D978: 13 | E978: of:=ABS([.B978])+ABS([.C978])+ABS([.D978]) -> 58
A979: 737 | B979: 28 | C979: -9 | D979: 21 | E979: of:=ABS([.B979])+ABS([.C979])+ABS([.D979]) -> 58
A980: 779 | B980: 16 | C980: -27 | D980: -15 | E980: of:=ABS([.B980])+ABS([.C980])+ABS([.D980]) -> 58
A981: 889 | B981: 14 | C981: 30 | D981: 14 | E981: of:=ABS([.B981])+ABS([.C981])+ABS([.D981]) -> 58
A982: 900 | B982: 21 | C982: -23 | D982: 14 | E982: of:=ABS([.B982])+ABS([.C982])+ABS([.D982]) -> 58
A983: 987 | B983: 26 | C983: -15 | D983: 17 | E983: of:=ABS([.B983])+ABS([.C983])+ABS([.D983]) -> 58
A984: 651 | B984: 31 | C984: 7 | D984: -21 | E984: of:=ABS([.B984])+ABS([.C984])+ABS([.D984]) -> 59
A985: 792 | B985: -27 | C985: 10 | D985: 22 | E985: of:=ABS([.B985])+ABS([.C985])+ABS([.D985]) -> 59
A986: 816 | B986: 15 | C986: 15 | D986: -29 | E986: of:=ABS([.B986])+ABS([.C986])+ABS([.D986]) -> 59
A987: 890 | B987: -16 | C987: 18 | D987: -26 | E987: of:=ABS([.B987])+ABS([.C987])+ABS([.D987]) -> 60
A988: 603 | B988: 24 | C988: -10 | D988: -27 | E988: of:=ABS([.B988])+ABS([.C988])+ABS([.D988]) -> 61
A989: 706 | B989: 20 | C989: -24 | D989: 18 | E989: of:=ABS([.B989])+ABS([.C989])+ABS([.D989]) -> 62
A990: 777 | B990: 22 | C990: -12 | D990: -28 | E990: of:=ABS([.B990])+ABS([.C990])+ABS([.D990]) -> 62
A991: 859 | B991: 14 | C991: -35 | D991: -13 | E991: of:=ABS([.B991])+ABS([.C991])+ABS([.D991]) -> 62
A992: 555 | B992: 15 | C992: -18 | D992: -30 | E992: of:=ABS([.B992])+ABS([.C992])+ABS([.D992]) -> 63
A993: 626 | B993: 16 | C993: -19 | D993: 28 | E993: of:=ABS([.B993])+ABS([.C993])+ABS([.D993]) -> 63
A994: 653 | B994: 19 | C994: 21 | D994: -23 | E994: of:=ABS([.B994])+ABS([.C994])+ABS([.D994]) -> 63
A995: 703 | B995: 16 | C995: -29 | D995: -18 | E995: of:=ABS([.B995])+ABS([.C995])+ABS([.D995]) -> 63
A996: 748 | B996: -12 | C996: 34 | D996: 17 | E996: of:=ABS([.B996])+ABS([.C996])+ABS([.D996]) -> 63
A997: 939 | B997: 19 | C997: -29 | D997: 15 | E997: of:=ABS([.B997])+ABS([.C997])+ABS([.D997]) -> 63
A998: 557 | B998: 23 | C998: -17 | D998: -24 | E998: of:=ABS([.B998])+ABS([.C998])+ABS([.D998]) -> 64
A999: 701 | B999: 22 | C999: 22 | D999: -22 | E999: of:=ABS([.B999])+ABS([.C999])+ABS([.D999]) -> 66
A1000: 761 | B1000: 10 | C1000: 34 | D1000: -23 | E1000: of:=ABS([.B1000])+ABS([.C1000])+ABS([.D1000]) -> 67